#ID,名称,CharaID,メッセージ（全角26文字x2行）,ボイスID,表情差分,エモーション,
#,,,科学サイドストーリー Chapter7,
#,,,広まる噂,
#,,,#【学園都市・路地裏・夕】,
1,不良たち,,「待てやコラァーっ！！」,,0,
2,御坂 美琴,4000102,ちょっと、どうすんのよコレ！？<br>黒子、<ruby>空間移動</ruby>は使えないの！？,900040017,21,ef_com_00100_002_003_00,
3,白井 黒子,5000101,い、いえ、使えることには使えるのですが、<br>ここで逃げてしまってはいけないような……。,900050017,14,ef_com_00100_002_004_00,
4,御坂 美琴,4000102,そんなこと言ってる場合！？<br>もう追いつかれるわよ！！,900040018,15,ef_com_00100_002_003_00,
5,？？？,999000101,――そこで止まるじゃんよ！,900070028,20,
6,不良Ａ,516000106,なんだテメェは！？,905040030,20,ef_com_00100_002_005_00,
7,黄泉川 愛穂,7000701,<ruby>警備員</ruby>じゃんよ。<br>通報があったから来てはみたが……。,900070006,10,
8,黄泉川 愛穂,7000701,なんだか見知った顔ばっかじゃんよ。<br>こんなせまっこいところで何してるじゃん？,900070004,11,ef_com_00100_002_001_00,
9,不良Ａ,516000106,コイツが猫を虐めてたんだよ！！,905040024,13,
10,御坂 美琴,4000102,はあ！？　何で私が！？,900040018,20,
11,不良Ｂ,504000106,お前が触ろうとしたら嫌がってただろうが！,905040033,13,
12,御坂 美琴,4000102,それは私の体質のせいで……！<br>元はといえばアンタらが悪いんでしょ！！,900040021,21,ef_com_00100_002_003_00,
13,御坂 美琴,4000102,このバカを殴ろうとしてた所だったじゃない！<br>私はただ止めようとしただけよ！！,900040005,13,
14,上条 当麻,1000101,それには色々と事情があったんだよ！<br>いや、確かに殴られたくはなかったんだけどな！？,900010030,21,ef_com_00100_002_003_00,
15,黄泉川 愛穂,7000701,ん？　何がどうなってるじゃんよ？<br>状況が飲み込めないんだが……。,900070030,15,ef_com_00100_002_002_00,
16,黄泉川 愛穂,7000701,白井。<ruby>風紀委員</ruby>としてしっかりと説明するじゃん。,900070029,
17,白井 黒子,5000101,は、はい。実はその、元はといえばわたくしが……。,900050006,14,ef_com_00100_002_003_00,
18,黄泉川 愛穂,7000701,……なるほど、大体わかったじゃん。,900070003,11,ef_com_00100_002_001_00,
19,黄泉川 愛穂,7000701,つまり、そこの三人組は猫を助けようとしていたのに、<br>白井、お前が勘違いして襲ってしまった、と。,0,20,
20,黄泉川 愛穂,7000701,そこの二人も。正義感があるのは結構だが、<br>事実確認もしないで動くなんて軽率すぎるじゃん。,900070015,11,
21,上条たち,,「はい……」,,0,ef_com_00100_002_004_00,
22,黄泉川 愛穂,7000701,白井。あとで説教、いや、罰として腕立て三百回だ。,900070005,20,
23,白井 黒子,5000101,ぬぐあっ！？　そんな、ご容赦くださいまし……！,900050017,15,ef_com_00100_002_003_00,
24,黄泉川 愛穂,7000701,問答無用じゃん！ <br>……さーて、悪かったな君達。ウチのが迷惑をかけた。,900070021,13,
25,黄泉川 愛穂,7000701,でも、どうして猫を助けようと？<br>そういうこと、するようなタイプじゃないじゃん？,900070005,14,ef_com_00100_002_002_00,
26,不良Ａ,516000106,ガラじゃねえってのは、俺達もわかってるよ。<br>でも、アレを受け取っちまったからな。,905040006,11,ef_com_00100_002_006_00,
27,黄泉川 愛穂,7000701,アレ？　アレとは何の事じゃん？,900070004,15,ef_com_00100_002_002_00,
28,不良Ｂ,504000106,不幸のメールだよ。善い行いをしないと、<br>ケータイのデータが消されるっていう……。,905040035,14,ef_com_00100_002_003_00,
29,黄泉川 愛穂,7000701,あー。そういえばそんな報告があったじゃん。<br>不良のくせにそんなの信じてるって格好悪いじゃん？,900070006,11,
30,不良Ｃ,516000106,うるせえ！　<br>アウトローってのはジンクスを信じるもんなんだよ！,905040055,13,
31,黄泉川 愛穂,7000701,そういうもんかねぇ。<br>ま、良いことしようとした奴らに文句はないじゃんよ。,900070003,10,
32,不良Ａ,516000106,別に、本気で良いことをしようだなんて思ってねえよ。<br>ただ、仕方なくだな……。,905040017,17,ef_com_00100_002_003_00,
33,不良Ｂ,504000106,おい！　そういやあの猫ちゃん、あのままじゃねえか！<br>ちくしょう、早く助けにいくぞ！！,905040058,13,
34,不良Ｃ,516000106,うおおおおおおっ！　待ってろ子猫ちゃーんっ！！,905040011,15,
35,上条 当麻,1000101,いや、ただの猫好きだろ実はオマエらっ！？,900010002,21,ef_com_00100_002_004_00,


