#ID,名称,CharaID,メッセージ,ボイスID,表情差分,エモーション,
#,スポット会話,,チャプター09：駅周辺　五和　　,
#,,,来ちゃった♪作戦,
1,五和,30000101,こ、ここまで来てしまってから言うのも何ですが、<br>突然お宅に伺うなんて、迷惑じゃ……。,900300015,14,ef_com_00100_002_003_00,
2,五和,30000101,天草式のみんなに提案された『えへへ、来ちゃった♪』<br>作戦ですが、いざとなると……。,0,11,
3,五和,30000101,やっぱり今日は帰りましょうか。,0,20,
4,五和,30000101,でも、せっかく購入した食材が<br>無駄になってしまうのは勿体ない気も。,900300024,14,
5,五和,30000101,はぁ……やっぱり提案Ｂの、<br>『作り過ぎちゃったのでお裾分けです♪』,900300015,12,ef_com_00100_002_000_00,
6,五和,30000101,っていう作戦のほうが、トライしやすかったかも……。,0,14,ef_com_00100_002_006_00,





