#ID,名称,CharaID,メッセージ,ボイスID,表情差分,エモーション,
#,,,神裂 火織 チャプター02,
#,,,VS電子レンジ,,,,
#,,,#【地下街・通路・昼】,
1,神裂 火織,25000101,ステイルとの定期報告のため、学園都市に潜伏する<br>魔術師の痕跡がない地下街へとやって来ましたが……。,1,14,
2,神裂 火織,25000101,……早く着きすぎましたね。<br>仕方ありません。ステイルが来るまで待ちましょう。,1,11,
3,神裂 火織,25000101,（地下街には飲食店やゲームセンターが多いですね。<br>……ん？　雰囲気の違うあの店舗は家電量販店ですか）,1,10,
4,神裂 火織,25000101,店頭にある箱は……電子レンジ？<br>ほう。お試しで使ってみる事ができるのですね。,1,12,ef_com_00100_002_001_00,
5,神裂 火織,25000101,以前、土御門に調理家電ぐらい使える方が良いと<br>言われた事がありましたね……少し試してみましょうか。,1,10,
6,神裂 火織,25000101,ええと、まずは食べ物を中に入れ……次は……<br>メニューの選択？　ふむ。やはり良く分かりませんね。,1,14,ef_com_00100_002_006_00,
7,ステイル,24000101,……はぁ、ようやく見つけたぞ、神裂。,1,14,ef_com_00100_002_001_00,
8,ステイル,24000101,待ち合わせ場所にいないと思えば……。<br>定期報告の事を忘れていたのかい？,1,12,
9,神裂 火織,25000101,え、あぁ、ステイルですか。<br>もう来ていたのですね、すみませんでした。,1,10,
10,神裂 火織,25000101,どうです？　学園都市に潜伏している魔術師について、<br>何か進展はありましたか？,1,10,
11,ステイル,24000101,この街に潜伏しているのは確かなはずなんだが……<br>残念ながら進展なしだ。,1,14,
12,ステイル,24000101,どうやら逃げ隠れする事が得意な魔術師らしい。<br>中々足取りが掴めずにいるよ。,1,16,
13,神裂 火織,25000101,そうですか。引き続き警戒しながら、探しましょう。<br>私も捜索範囲を広げてみます。,1,11,
14,ステイル,24000101,分かった。<br>……ところで一つ聞いてもいいかい？,1,10,
15,神裂 火織,25000101,はい？　何でしょうか。,1,10,ef_com_00100_002_002_00,
16,ステイル,24000101,君はこの報告を受ける先ほどまで、何をしていたんだ？,1,14,
17,神裂 火織,25000101,あぁ、その事ですか。実は、<br>この電子レンジのお試しをしてみようと思いまして。,1,12,ef_com_00100_002_001_00,
18,ステイル,24000101,電子レンジって……君の苦手な電子機器じゃないか。<br>よく試そうと思ったね？,1,15,
19,神裂 火織,25000101,ええ、まぁ。かまどで充分だとは思うのですが……。<br>使えるようになれば便利だと土御門が言っていたので。,1,14,
20,ステイル,24000101,まぁ、確かにそうかもしれないね。<br>調理の時間が短縮されるのは間違いないだろう。,1,12,
21,神裂 火織,25000101,……詳しそうな口振りですね。そういえば、<br>あなたは科学にも見識がありましたね？,1,12,ef_com_00100_002_001_00,
22,ステイル,24000101,別に詳しいって程じゃないさ。<br>人並みには使えるというだけだよ。,1,11,
23,神裂 火織,25000101,使えているだけでも、私から見ればすごいのですが……。,1,14,
24,神裂 火織,25000101,それはともかく、お願いがあります。<br>私にこの電子レンジの使い方を教えてもらえませんか？,1,10,
25,神裂 火織,25000101,色々と操作してみたのですが、<br>どうにも使い方が分からなくて。,1,14,ef_com_00100_002_006_00,
26,ステイル,24000101,神裂から魔術以外の事で頼られるのは珍しい。<br>いいよ、それくらい付き合おうじゃないか。,1,12,ef_com_00100_002_001_00,
27,ステイル,24000101,良く見ているといい。<br>まずは食材を器に入れて、それを中に置いたら――。,1,10,
#,,,#【時間経過】,
28,ステイル,24000101,……できたね。<br>でき上がった物を取り出して、これで終わりだ。,1,12,,
29,神裂 火織,25000101,こんな一瞬で満遍なく食材が温まるとは！<br>しかもそれを自動でやってくれるなんて……！,1,12,ef_com_00100_002_007_00,
30,神裂 火織,25000101,確かに、使いこなせれば便利そうですね！,1,10,
31,神裂 火織,25000101,ステイル、ありがとうございます。<br>こういう事を頼れるのはあなたぐらいですから。,1,12,ef_com_00100_002_000_00,
32,ステイル,24000101,この程度、何て事ないさ。<br>さて、使い方は分かっただろう？　早速使ってみなよ。,1,11,
33,神裂 火織,25000101,はい！　まずはレンジの中に物を入れるのでしたね。,1,10,ef_com_00100_002_001_00,
34,神裂 火織,25000101,一つ、二つ……三つ四つ五つ六つ……。,1,11,
35,ステイル,24000101,……おい、ちょっと待て。<br>君は何をしているんだ？,1,15,ef_com_00100_002_003_00,
36,神裂 火織,25000101,何って、レンジに物を詰めているのですが。,1,14,ef_com_00100_002_002_00,
37,ステイル,24000101,い、いくら何でも入れすぎだろう。,1,14,
38,神裂 火織,25000101,いえ、そんな事はありませんよステイル。<br>だってまだこんなにスペースがあるんですから。,1,13,
39,神裂 火織,25000101,詰め込めるだけ詰め込んで、全部一気に温めた方が、<br>より時間の短縮になるでしょう？,1,12,ef_com_00100_002_002_00,
40,ステイル,24000101,いや、そのためにスペースが空いている訳では……。,1,14,
41,神裂 火織,25000101,次にボタンを……超出力モード？<br>なるほど、先程よりも強力な熱で温めをするのですね。,1,12,ef_com_00100_002_001_00,
42,ステイル,24000101,待つんだ、神裂。<br>何か嫌な予感が……！,1,15,ef_com_00100_002_003_00,
43,神裂 火織,25000101,あとはこのボタンで起動させるだけですね。<br>では……いざっ！,1,13,
44,ステイル,24000101,お、おい大丈夫なのか、これは？<br>ガタガタと不穏な音を立てているぞ。,1,15,
45,神裂 火織,25000101,おかしいですね。ステイルがやった時は、<br>こんな音はしなかったはずですが……。,1,14,ef_com_00100_002_002_00,
46,神裂 火織,25000101,見てくださいステイル。あなたの時と違い、<br>煙が出てきました。まるで爆発寸前のような……。,1,12,
47,ステイル,24000101,まさにその通りだ！<br>神裂、避けろ！,1,15,ef_com_00100_002_003_00,
48,神裂 火織,25000101,なっ……！　くっ！,1,21,,
49,ステイル,24000101,……危ないところだったね。<br>まさか電子レンジを爆発させるとは……神裂、大丈夫か？,1,16,
50,神裂 火織,25000101,ええ、私は問題ありません。<br>ステイル、あなたの方は大丈夫ですか？,1,14,
51,ステイル,24000101,ああ、何とかね。まったく……<br>君がここまで科学オンチだとは思わなかったよ。,1,14,ef_com_00100_002_006_00,
52,神裂 火織,25000101,すいませんでした……。<br>どうやら私に電子レンジは扱いきれないようです。,1,14,ef_com_00100_002_004_00,
53,神裂 火織,25000101,やはり科学に頼らず自力でやるに限りますね……。,1,14,
#,,,#END,

