#ID,名称,CharaID,メッセージ,ボイスID,表情差分,エモーション,
#,,,組織名 Chapter8,
#,,,パーティーの始まり,,,,
#,,,#【上条当麻の部屋（室内ライト）】,
#,,,#SE（クラッカー音：ポンッ）,
1,上条たち,,メリークリスマース！！,0,,,
2,レッサー,80000801,いやー、それにしてもこのプレゼントは<br>ちょっと気前良すぎじゃないです？,900800008,10,
3,インデックス,2001801,信じられない……流石にこれは<br>クリスマスプレゼントという概念を超越した何かで……。,900020006,15,ef_com_00100_002_004_00,
4,上条 当麻,1000901,俺なんか価値も使い方もわからないのに<br>なんかすげぇ申し訳ないっていうか。,900010006,10,
5,レイヴィニア,43000801,今日は特別な日だからな。<br>それにどうせ死蔵在庫だと言っているだろう。,900430008,12,ef_com_00100_002_000_00,
6,レイヴィニア,43000801,仕舞ったままにしているより、<br>世に出した方がよほど有意義さ。,0,10,
7,上条 当麻,1000901,オティヌスは流石肝がすわってるっていうか、<br>落ち着いたもんだな。,900010029,10,
8,オティヌス,45000801,？　当人がくれると言っているのだ、<br>遠慮することはないだろう。,900450008,10,
9,オティヌス,45000801,それより、これはもう食べてもいいのか？,0,10,
10,レッサー,80000801,どうぞどうぞ！　料理ならたくさん用意したんで、<br>遠慮なくいっぱい食べてくださいね！,900800006,12,ef_com_00100_002_000_00,
#,,,#SE（カラトリー音：カチャカチャ）,
11,上条 当麻,1000901,さっき味見した時も思ったけど、やっぱこれ美味いな。<br>こっちのも貰っていいか？,900010005,12,ef_com_00100_002_000_00,
12,インデックス,2001801,あっ、それなら私だって食べてみたいんだよ！,900020006,12,
13,レイヴィニア,43000801,ついでにこっちにもとりわけてくれ。,900430005,10,
#,,,#【時間経過】,
14,上条 当麻,1000901,はー、食べた食べた……。,900010006,12,
15,レッサー,80000801,山盛り作ったのに、<br>みんなしてよく食べ切りましたね。,900800009,15,ef_com_00100_002_004_00,
16,レッサー,80000801,でも作ったものを綺麗に食べてもらえるのは<br>気持ちが良いと言いますか。,0,12,ef_com_00100_002_000_00,
17,レイヴィニア,43000801,そういえばデザートがないな。,900430005,10,
18,上条 当麻,1000901,あー、そういやすっかり忘れてたな……。,900010006,10,ef_com_00100_002_006_00,
19,インデックス,2001801,あ、それなら任せて！,900020002,12,ef_com_00100_002_001_00,
20,インデックス,2001801,昨日まいかから直々にメイドさん特製<br>クリスマスケーキの作り方を教えてもらったんだよ！,0,10,
#,,,#【上条当麻の部屋（昼）】回想,
21,,,――昨日、土御門の部屋。,0,
22,インデックス,2000101,できたー！,900020011,12,ef_com_00100_002_000_00,
23,土御門 舞夏,39000201,ケーキ完成なのだー！,900390011,10,ef_com_00100_002_000_00,
24,インデックス,2000101,これもまいかの指導のおかげだね。,900020002,10,
25,土御門 舞夏,39000201,いやいや、こういうのは努力の結果だぞ。,900390008,11,
26,土御門 舞夏,39000201,愛の力があれば、<br>何だってできてしまうのだー！,0,10,
27,インデックス,2000101,でも、私ひとりで<br>こんなに上手に作れるか心配なんだよ……。,900020023,14,ef_com_00100_002_006_00,
28,土御門 舞夏,39000201,心配せずとも、この出来ならば<br>当日も自力で何とかなるだろー。,900390006,20,
29,インデックス,2000101,そうだね！　頑張って、必ずとうまに<br>美味しいって言わせてみせるんだよ！,900020005,10,
30,土御門 舞夏,39000201,喜んでくれるといいなー。,900390002,10,
31,インデックス,2000101,うん！,900020006,12,ef_com_00100_002_000_00,
#,,,#【上条当麻の部屋（室内ライト）】,
32,インデックス,2001801,とうまたちがツリーを取りに行っている間に<br>コッソリ下ごしらえをしておいたから。,900020002,10,
33,インデックス,2001801,さっき、最後の仕上げをしていたんだ♪,0,12,ef_com_00100_002_000_00,
34,上条 当麻,1000901,なるほど。大事なことってそういう話か。,900010006,12,
35,インデックス,2001801,それじゃ持ってくるから少しだけ待ってて！,900020005,12,,
36,上条 当麻,1000901,（まさかインデックスが<br>ケーキを用意してくれてたなんてな……）,900010004,11,
37,上条 当麻,1000901,（思いがけない成長に、<br>上条さんってば、うっかり感動の涙が……）,0,12,
38,オティヌス,45000801,……帰ってこないな。,900450029,14,
39,レッサー,80000801,確かに。完成品を持ってくるだけなのに、<br>随分遅いですね。,900800003,14,ef_com_00100_002_006_00,
40,レイヴィニア,43000801,何かあったのかもな。,900430006,15,
41,上条 当麻,1000901,ちょっと様子を見にいってくるか。,900010029,10,
42,インデックス,2001801,…………。,900020016,14,,
43,上条 当麻,1000901,って、インデックス？<br>どうしたんだ、何かあったのか？,900010028,15,
44,インデックス,2001801,うぅっ……とうま、これ。,900020012,14,ef_com_00100_002_003_00,
45,上条たち,,あー……。,0,,,
#,,,#END,



















































































