#ID,名称,CharaID,メッセージ,ボイスID,表情差分,エモーション,
#,,,チャプター23：病院　御坂 美琴　白井 黒子　,,,,
#,,,病院クリームソーダ,
1,白井 黒子,5000102,さて……お見舞いも終わりましたし<br>お姉様、寮に帰りましょう。,900050002,11,ef_com_00100_002_001_00,
2,御坂 美琴,4000102,あーうん。ねえ、その前にさー、病院の喫茶店で<br>お茶してかない？,900040005,10,
3,白井 黒子,5000102,お姉様とお茶はいつだって歓迎ですの！　……けど、<br>わざわざ病院で？　<ruby>学舎の園</ruby>でもよろしいのでは……。,900050004,10,ef_com_00100_002_002_00,
4,御坂 美琴,4000102,なんかさ、病院の喫茶店って、妙にワクワクしない？<br>そこはかとなくレトロで、ちょっと非日常でさ。,900040006,12,
5,白井 黒子,5000102,そうですの？　あまり利用した経験がございませんの。<br>そこはかとなくレトロと言うと、例えばどのような？,900050005,15,
6,御坂 美琴,4000102,ほら、見てよ、あのウィンドウの中のクリームソーダ。<br>真っ赤なチェリーの乗ってるやつ！　レトロでしょ？,900040005,10,ef_com_00100_002_000_00,
7,白井 黒子,5000102,ふーん……あれがレトロなんですのね。<br>……なにやら毒そのもののような色味ですの。,900050015,14,
8,御坂 美琴,4000102,え、見たことないの？　クリームソーダ。,900040017,15,ef_com_00100_002_001_00,
9,白井 黒子,5000102,むかーし見たことはあるような気はしますが、<br>飲んだことは……。そんなに美味しいものなんですの？,900050006,10,
10,御坂 美琴,4000102,ん～……厳密に言うと甘いだけなんだけど、なんか、<br>病みつきになるというか……。あたしは好きだなー。,900040005,11,
11,白井 黒子,5000102,そうですの？　　お姉様が好きなのでしたら、<br>わたくしも飲みますの！　１０杯でも、２０杯でも！,900050030,12,ef_com_00100_002_001_00,
12,御坂 美琴,4000102,そんなに飲んだら即お腹壊すわよ。で、そのまま<br>ここの内科病棟に直行よ……ある意味便利だけど。,900040030,15,
13,白井 黒子,5000102,お姉様のおススメでしたら、何杯飲んでもお腹など<br>壊しませんの！　さ、参りましょうお姉様、いざ！,900050011,21,ef_com_00100_002_007_00,
14,御坂 美琴,4000102,すっごい乗り気になってくれたのはいいけど、<br>程々にしときなさいよ……。,900040002,14,ef_com_00100_002_004_00,
