#ID,名称,CharaID,メッセージ（全角26文字x2行）,ボイスID,表情差分,エモーション,
#,,,レイドイベント: 科学サイドポリスコスプレ（仮） チャプター02,
#,,,ルールあっての安全,,,,
#,,,#【公園・全景・昼】,
1,上条 当麻,1002401,（ちょっと目を離した隙に<br>あの子達どこ行っちゃったんだ？）,900010016,21,ef_com_00100_002_004_00,
2,上条 当麻,1002401,施設の外に飛び出していった子供達は……<br>いたぞ、あそこだ御坂！,900010029,15,ef_com_00100_002_001_00,
3,御坂 美琴,4003101,信号で足止めされたみたいね。<br>今がチャンスよ、急ぎましょう！,900040005,20,,
4,男の子,58000101,だれが一番はやく公園につくか競争しようぜー！,900580011,12,,
5,女の子,59000101,おもしろそう！　じゃあ信号が青になったらスタートね！,900590002,12,,
6,上条 当麻,1002401,なんか今にも走り出しそうだぞ！？<br>周りも見えてねぇみたいだ！,900010018,15,ef_com_00100_002_003_00,
7,御坂 美琴,4003101,ッ！！　ちょっとアレ、横断歩道に近づいてる車が<br>フラフラしながらスピードも落ちてないけど、まさか！？,900040017,15,ef_com_00100_002_003_00,
8,上条 当麻,1002401,くそっ、こうなりゃ、子供達に抱き着いてでも……！,900010025,20,
9,御坂 美琴,4003101,あの馬鹿っ！考えもなしに！<br>……私が車を止めるっ！！,900040021,15,ef_com_00100_002_003_00,
10,男の子,58000101,青になった！　よーい、どんっ！！,900580001,10,,
11,女の子,59000101,あっ、待って！　クルマがきてるよ……っ！！,900590017,15,ef_com_00100_002_003_00,
12,男の子,58000101,っ！？,900580030,15,ef_com_00100_002_001_00,
13,上条 当麻,1002401,おぉおおおおっ！,900010025,20,,
14,御坂 美琴,4003101,こんのぉおお……っ！！,900040022,13,,
15,上条 当麻,1002401,っ……大丈夫か！？,900010028,21,,
16,男の子,58000101,せんせーをしてた、お兄ちゃんとお姉ちゃん……？<br>今クルマが……え、あ、なにが……？,900580017,15,ef_com_00100_002_002_00,
17,上条 当麻,1002401,間一髪だったな。<br>もう少しで車にはねられるところだったんだ。,900010015,14,
18,上条 当麻,1002401,御坂、そっちの車の方は？,900010029,14,
19,御坂 美琴,4003101,磁力を全開にして止めたから大丈夫。運転手も無事よ。,900040006,22,
20,上条 当麻,1002401,ふぅ……事故も怪我もなくて良かった。,900010015,12,
21,上条 当麻,1002401,けど、そこのお姉ちゃんがいなかったら<br>どうなってたと思う？,900010008,20,
22,男の子,58000101,クルマにぶつかって……ぼく、ケガして……？,900580012,14,ef_com_00100_002_006_00,
23,御坂 美琴,4003101,そうね。だから、信号を渡るときは<br>ちゃんと周りを見ないといけないし、,900040005,10,
24,御坂 美琴,4003101,手を上げることで、車の人にも<br>気付いてもらいやすくしないとね。,0,12,
25,男の子,58000101,うん……。,900580006,14,
26,上条 当麻,1002401,今日は運良く無事で済んだけど、<br>そうならない事の方がずっと多い。,900010029,10,
27,上条 当麻,1002401,だから、自分で安全を確認する事が大切なんだ。<br>面倒でもそれだけで助かる確率はぐっと高くなる。,0,10,
28,御坂 美琴,4003101,そして、それを知ってもらうための<br>今日の交通安全指導って訳よ。みんな、分かったかしら？,900040006,12,
29,子供たち,,「はい、ごめんなさい……」,,,,
30,鉄装 綴里,127000101,みんな大丈夫！？　怪我はない！？,901270019,15,ef_com_00100_002_003_00,
31,上条 当麻,1002401,はい、見ての通りなんとか全員無傷です。,900010005,10,
32,鉄装 綴里,127000101,よ、良かったぁ……。<br>私がいながらなんて不甲斐ない……ごめんなさい。,901270015,14,ef_com_00100_002_006_00,
33,鉄装 綴里,127000101,貴方達がいてくれて助かったわ、本当にありがとう。,901270014,10,
34,鉄装 綴里,127000101,あっ、私は運転していた人の様子を見てくるから<br>二人は子供達を連れて先に施設に戻ってて……！,0,15,ef_com_00100_002_001_00,
#,,,#【公園・内部Ａ・昼】,
35,御坂妹,21001101,見事な連携でした、とミサカは素直に称賛します。,900210009,10,,
36,上条 当麻,1002401,見てたのか？　いやまぁ、俺は何もしてないよ。<br>子供達に怪我がなかったのは御坂のおかげだし。,900010002,12,
37,御坂 美琴,4003101,あれくらい朝飯前よ。むしろ私は、<br>体一つで子供達をかばうアンタに呆れちゃうけどね。,900040002,10,
38,御坂妹,21001101,またもや息の合ったやり取りが……<br>とミサカは自分の存在意義の消失に戦々恐々とします。,900210015,14,ef_com_00100_002_006_00,
39,御坂 美琴,4003101,何言ってんの、アンタの役目はこれからでしょ？<br>良い例ができたし、交通安全指導を最初からおさらいよ！,900040017,17,,
#,,,#【場面転換】,
#,,,#【公園・内部Ｂ・昼】,
40,男の子,58000101,信号が青になったよ！<br>右をみて、左をみて、よしっいこうー！,900580029,10,,
41,女の子,59000101,だいじょーぶ？　ひとりで渡れるー？,900590019,14,ef_com_00100_002_004_00,
42,一方通行,13002101,……問題ねェ。このまま渡れる。,900130015,20,
43,男の子,58000101,じゃあじゃあ、<br>クルマが来るかもしれないから先導するね！,900580005,12,
44,黄泉川 愛穂,7000701,うん、周囲の確認に他人への気遣いまでして<br>みんなバッチリじゃんよ。,900070006,12,,
45,黄泉川 愛穂,7000701,あとは、横断旗を持って<br>運転手に信号を渡ってますよって伝えるじゃん。,0,10,
46,打ち止め,22001701,右よーし！　左よーし！　もう一回右よーし！<br>ってミサカはミサカは入念に左右の確認をしてみるっ。,900220011,20,ef_com_00100_002_000_00,
47,一方通行,13002101,おい、ガキに交じって何してンだ。,900130028,22,
48,打ち止め,22001701,ミサカは交通安全指導員だから<br>あなたの安全を守るために奮闘中なのだ！,900220005,10,
49,打ち止め,22001701,ってミサカはミサカはあなたの手を握って<br>一緒に信号を渡ろうとしてみたり。,0,12,
50,一方通行,13002101,介護が必要なほど不自由はしてねェよ。,900130025,11,
51,黄泉川 愛穂,7000701,たとえ本当にそうだったとしても、<br>誰にだって万が一はあるものじゃん。,900070005,10,
52,黄泉川 愛穂,7000701,親切にするのは悪い事ではないじゃんよ。<br>特に、君みたいな素直じゃない子にはね。,0,12,
53,打ち止め,22001701,だってさ。さぁさぁ観念して一緒に来るのだー！<br>ってミサカはミサカは手を上げて信号を渡ってみたり。,900220002,12,
54,女の子,59000101,わたしも、わたしも！　いっしょに渡るー！！,0,12,
55,一方通行,13002101,チッ、言い返すのも面倒臭ェ。勝手にしろ。,900130013,16,ef_com_00100_002_006_00,
56,黄泉川 愛穂,7000701,ふふん、ようやく観念したか。<br>それじゃあこれが終わったら次の内容にいくじゃん。,900070004,12,
57,黄泉川 愛穂,7000701,交通ルールはまだまだあるからね。<br>全員、しっかり覚えて帰るじゃんよ！,900070002,12,ef_com_00100_002_007_00,
#,,,#END,
