#ID,名称,CharaID,メッセージ（全角26文字x2行）,ボイスID,表情差分,エモーション,
#,,,科学サイドストーリー Chapter6,
#,,,譲れないもの,
#,,,#【学園都市・路地裏・夕】,
1,御坂 美琴,4000102,はぁ、そのへんの不良にやられるとか止めてよね。<br>アンタに勝つのは私だけでいいんだから。,900040015,20,ef_com_00100_002_004_00,
2,上条 当麻,1000101,待ってくれ御坂！　これには深い事情があってだな！,900010017,15,ef_com_00100_002_003_00,
3,御坂 美琴,4000102,どうせくだらない事でしょ。<br>ほら、黒子、さっさとこいつら縛っちゃうわよ。,900040016,21,
4,白井 黒子,5000101,お待ち下さいお姉様！<br>実は、子猫さんがですね……。,900050017,14,ef_com_00100_002_003_00,
5,御坂 美琴,4000102,猫！？　わっ、可愛いじゃない！<br>ほら～降りておいで～。,900040030,15,ef_com_00100_002_001_00,
6,子猫,999000101,しゃああああああおっ！！　ふぎゃああああっ！！,,10,
7,御坂 美琴,4000102,そ、そうよね。電磁波は動物にはストレスよね。<br>でも少しでいいから撫でさせてくれないかなー。,900040012,14,ef_com_00100_002_006_00,
8,不良Ａ,516000106,おい、その猫に触るんじゃ、ねえっ……！！<br>ぶっ飛ばすぞコラ！,905040025,13,ef_com_00100_002_005_00,
9,不良Ｂ,504000106,で、でも、こいつ、常盤台の<ruby>超電磁砲</ruby>だぞ！？<br>俺達じゃ勝てねえよ！！,905040042,14,ef_com_00100_002_003_00,
10,不良Ｃ,516000106,情けねえこと言ってんじゃねえ！<br>ここで立ち向かわなきゃ漢じゃあねえだろ！！,905040022,13,ef_com_00100_002_005_00,
11,不良Ｂ,504000106,……ああ！　そうだな！！,905040035,13,
12,御坂 美琴,4000102,何をごちゃごちゃ言ってるわけ？<br>もういっぺんやられたいの？,900040018,13,ef_com_00100_002_005_00,
13,不良Ａ,516000106,ああ、いいぜ。だが、何度でも立ち上がってやる。<br>俺達はこんなところで負けるわけにはいかねーんだ！,905040035,13,
14,御坂 美琴,4000102,そ。じゃ、もう一発。,900040004,12,
15,不良たち,,「ぎゃああああああああああっ！！」,
16,御坂 美琴,4000102,ねえ、何なのコイツら？<br>やけに熱くなってるみたいだけど。,900040029,20,
17,白井 黒子,5000101,あわわ、お、お姉様！？　それ以上は駄目ですの！！,900050021,15,ef_com_00100_002_003_00,
18,御坂 美琴,4000102,え？　何がよ。<br>ってうわっ！？　まだ立ち上がれるの！？,900040018,15,ef_com_00100_002_002_00,
19,不良Ａ,516000106,――だから、負けられねえって言ったろ？,905040027,11,
20,不良Ｂ,504000106,横暴な<ruby>風紀委員</ruby>も、その仲間も許せねえが！<br>何より俺達はこの猫ちゃんを救わなきゃならねえんだ！,905040054,13,
21,御坂 美琴,4000102,守る？　え、私から？,900040017,15,
22,上条 当麻,1000101,おい御坂。だから話を聞けって言ったろ……。<br>どうしてお前はいつもこう、手が早いんだよ……。,900010018,21,ef_com_00100_002_006_00,
23,白井 黒子,5000101,まったくですの。普段から喧嘩っ早くて、<br>事後処理するこちらの身にもなって欲しいですわ。,900050018,14,ef_com_00100_002_006_00,
24,御坂 美琴,4000102,ちょっと！　なんでアンタらも不良の側についてんのよ！,900040021,13,ef_com_00100_002_005_00,
25,不良Ａ,516000106,そうだ！　お前らも同罪なんだからな！<br>ドサクサに紛れてウヤムヤにしようとすんじゃねえ！！,905040006,13,
26,上条 当麻,1000101,まあ、そうなるか。白井、頼んだ。<br><ruby>風紀委員</ruby>なら喧嘩の仲裁とかも慣れてるだろ？,900010015,11,
27,白井 黒子,5000101,ちょっとっ！　わたくしに押し付けるんですの……？<br>これはもう、話をすること自体無理ではございません？,900050003,15,
28,御坂 美琴,4000102,ちょっと二人共、納得いく説明が欲しいんだけど！！,900040029,20,ef_com_00100_002_005_00,
29,不良たち,,「勝負だテメエら！！」,,0,
30,上条 当麻,1000101,スゲェ気迫だ……。<br>こりゃ無事じゃ済まねーかもな……。逃げるぞ！！,900010010,15,ef_com_00100_002_003_00,
31,御坂 美琴,4000102,逃げるって、こんなやつらぶっ飛ばしちゃえば……！,900040018,13,
32,白井 黒子,5000101,だからそれは駄目ですのよお姉様！！<br>空気をお読みになってください！！　行きますよ！！,900050018,15,ef_com_00100_002_003_00,
33,御坂 美琴,4000102,えっ、ちょっと！<br>どういうことか説明しなさいよ、バカーっ！！,900040021,13,
34,不良たち,,「待てやゴルァーッ！！！！！！」,,0,
35,御坂 美琴,4000102,だからどういう状況なのよコレーっ！！,900040017,21,ef_com_00100_002_006_00,
36,子猫,999000101,にゃーう。にゃにゃん♪,,10,


