#ID,名称,CharaID,メッセージ,ボイスID,表情差分,エモーション,
#,,,チャプター15：病院　ラストオーダー　御坂妹　,,,,
#,,,あなたにお花を,
1,打ち止め,22000101,これを早く見せてあの人の笑顔が見たいって、<br>ミサカはミサカは病室まで急いでみたり♪,900220001,12,ef_com_00100_002_000_00,
2,御坂妹,21000101,お待ちなさい。,900210028,10,
3,打ち止め,22000101,むむっ！？,900220030,13,
4,御坂妹,21000101,ここは病院ですのでお静かに。と、ミサカは公共マナーに<br>乗っ取って、違反行為に対しビシっと注意を促します。,900210025,11,
5,打ち止め,22000101,あっ、そうだったね……気がはやるあまり忘れてたの。<br>って、ミサカはミサカは我にかえって反省してみたり。,900220013,15,ef_com_00100_002_003_00,
6,御坂妹,21000101,もしやその花を届けるために？<br>と、ミサカは至極真面目な表情で問いかけます。,900210006,10,
7,打ち止め,22000101,うん。中庭にとっても綺麗なお花が咲いてたから、<br>病室に飾ってあげたくて少し分けてもらったの。,900220006,12,
8,打ち止め,22000101,って、ミサカはミサカは愛しそうに<br>お花をじっと見つめてみたり。,0,10,
9,御坂妹,21000101,それならば急ぎ足でどうぞ。<br>と、ミサカは走らずに急ぐ方法を提案します。,900210002,11,
10,打ち止め,22000101,わかった、そうするね。って、ミサカはミサカは<br>早足で再び病室に向かってみたり♪,900220005,12,
