#ID,名称,CharaID,メッセージ,ボイスID,表情差分,エモーション,
#,,,初春 飾利 チャプター05,
#,,,“お嬢様”ファン？,,,,
#,,,#【風紀委員活動第一七七支部・室内・昼】,
1,初春 飾利,36000101,うーん……うーん……やっぱり良いなぁ。,1,11,ef_com_00100_002_007_00,
2,白井 黒子,5000102,さっきから何を唸ってますの？　<ruby>風紀委員</ruby>の支部で<br>あんまり妙な声を出していると、拘束されますわよ。,1,11,,
3,初春 飾利,36000101,う、唸ってましたか！？　すみません……。<br>つい、口に出しちゃってたみたいで……。,1,15,ef_com_00100_002_003_00,
4,佐天 涙子,37000101,それで、初春は変な声出してどうしたの？,1,10,ef_com_00100_002_002_00,
5,初春 飾利,36000101,はい……ええと、常盤台中学の制服って<br>やっぱり良いなぁと思いまして。,1,10,
6,御坂 美琴,4000102,えっ、私達が着てるこの制服？<br>……そんなに良いかしら。,1,15,
7,初春 飾利,36000101,だって、その制服は常盤台の代名詞じゃないですか。<br>はぁ～、憧れちゃいます……。,1,11,ef_com_00100_002_007_00,
8,佐天 涙子,37000101,あちゃー、目をキラキラさせちゃって……<br>まぁたお嬢様に憧れる初春の悪い癖が出ちゃってる。,1,21,
9,御坂 美琴,4000102,だからって、そんなに見られると恥ずかしいわね……。,1,17,ef_com_00100_002_003_00,
10,白井 黒子,5000102,ちょっと初春、その怪しい目で<br>舐め回すようにお姉様を見るのは、おやめなさい！,1,20,ef_com_00100_002_005_00,
11,初春 飾利,36000101,そ、そんな目はしていませんよ……！　私はただ、<br>常盤台の制服が着てみたいだけですよぉー！,1,90,ef_com_00100_002_003_00,
12,白井 黒子,5000102,もう、まだそんな事を言ってるんですの！？,1,22,
13,初春 飾利,36000101,白井さんにとっては『そんな事』でも、<br>私にとっては重要なんですよ！,1,20,
14,佐天 涙子,37000101,初春の執着もなかなかのものだねぇ。,1,21,
15,初春 飾利,36000101,佐天さんだって、着れるなら常盤台の制服を<br>一度くらいは着てみたくないんですか！？,1,10,
16,佐天 涙子,37000101,いやまぁ……全く興味がないと言えば嘘になるけどさ。,1,17,
17,御坂 美琴,4000102,うーん、貸してあげたい所なんだけど……。無断で<br>貸したのがバレたら、怒られるかもしれないのよね……。,1,14,ef_com_00100_002_006_00,
18,白井 黒子,5000102,常盤台の校則が厳しいのは初春も分かっているでしょう？<br>無理を言わないでちょうだいな。,1,14,
19,初春 飾利,36000101,うえ～ん！　それは分かってますけど～！,1,14,
20,佐天 涙子,37000101,それならさー、似たような服を買って着てみれば？,1,12,ef_com_00100_002_002_00,
21,佐天 涙子,37000101,ブラウスにベージュのベスト、灰色のスカート！<br>結構それっぽくなると思うけどな。,1,10,
22,佐天 涙子,37000101,あ、でもそうすると初春はミニスカート穿くんだね。<br>これは今まで以上にパンツが見れちゃいますな～。,1,21,ef_com_00100_002_000_00,
23,初春 飾利,36000101,ミニスカートになったからと言って<br>下着を見て良い訳ではないですからね！？,1,90,ef_com_00100_002_003_00,
24,初春 飾利,36000101,佐天さんみたいな人がいるから、御坂さんも<br>スカートの下に短パンを穿く羽目になるんです！,1,13,
25,御坂 美琴,4000102,いや別にそういう訳じゃないんだけど……。,1,15,
26,白井 黒子,5000102,とにかく。初春は常盤台中学の制服に<br>似た服を着て、欲望を満たしなさいな。,1,11,
27,初春 飾利,36000101,いえ、それではダメなんですよ白井さん！<br>姿形を似せれば良いという問題じゃないんです！,1,20,
28,初春 飾利,36000101,その制服がデザインされた背景や意味、<br>現在に至るまでのお嬢様学校としての歴史と文化……！,1,11,
29,初春 飾利,36000101,その全てが内包されてこその、制服なのです！,1,20,
30,初春 飾利,36000101,そして、私のような庶民ではなく選ばれた方達が<br>制服を纏う事で『常盤台の制服』は完成されるんですよ！,1,10,
31,佐天 涙子,37000101,……う、初春の並々ならぬ熱意を感じる。,1,16,ef_com_00100_002_003_00,
32,白井 黒子,5000102,ですが、それなら常盤台の学生ではない初春が制服を<br>着ても『常盤台の制服』ではなくなってませんこと？,1,14,ef_com_00100_002_002_00,
33,初春 飾利,36000101,うっ……！？<br>それはそうかもしれませんが……！,1,16,ef_com_00100_002_004_00,
34,初春 飾利,36000101,少しだけ、<br>歴史や文化を体験してみても良いじゃないですかぁ～！,1,14,
35,初春 飾利,36000101,常盤台の寮とか校舎とか、学舎の園とか、<br>私達庶民とは違う優雅な世界……！,1,11,
36,初春 飾利,36000101,それに間接的にでも触れる事が、<br>私にとってどんなに夢か！　うわぁ～ん！,1,14,
37,御坂 美琴,4000102,ちょ、ちょっと初春さん泣かないで！？<br>今度、何とかうまくやってみるから……！,1,15,ef_com_00100_002_003_00,
38,御坂 美琴,4000102,少し待っててくれないかしら、ね？,1,10,
39,初春 飾利,36000101,御坂さん……！　御坂さんは本当に優しいですね。<br>御坂さんのおかげで私、頑張れそうです！,1,12,ef_com_00100_002_007_00,
40,御坂 美琴,4000102,あはは……よ、よしよし。,1,12,
41,佐天 涙子,37000101,じゃあそれまでに、<br>初春はミニスカートの練習しなきゃね！,1,12,ef_com_00100_002_000_00,
42,初春 飾利,36000101,ミ、ミニスカートの練習って何ですか！？,1,15,ef_com_00100_002_003_00,
43,佐天 涙子,37000101,だって常盤台の制服のスカート、ウチより短いから<br>スースーして大変だよ？　今から慣れておかないと。,1,21,
44,初春 飾利,36000101,そ、そんなの必要ありませんよ！<br>佐天さんと一緒にしないでください！,1,90,ef_com_00100_002_003_00,
45,佐天 涙子,37000101,なっ！？　私はミニスカートくらい全然平気だからね！？,1,15,ef_com_00100_002_003_00,
46,御坂 美琴,4000102,ま、まぁまぁ……。<br>いざとなったら私の短パンも貸してあげるから。,1,12,
47,初春 飾利,36000101,みざがざんっ……！,1,17,
48,初春 飾利,36000101,やっぱり御坂さんは、佐天さんや白井さんとは違います！<br>私、御坂さんの制服が着たいです……っ！,1,12,ef_com_00100_002_007_00,
49,御坂 美琴,4000102,ちょ、ちょっと、どうしてそうなるの……！？<br>そんなの黒子じゃあるまいし……！,1,17,ef_com_00100_002_003_00,
50,初春 飾利,36000101,御坂さん、一生ついていきます！<br>だからどうかお願いします……っ！,1,20,
51,白井 黒子,5000102,はぁ、まったく……。,1,22,
52,白井 黒子,5000102,どうして初春は自分の好きなものの事になると、<br>突然メーターが振り切れるのでしょうね……。,1,11,ef_com_00100_002_004_00,
53,佐天 涙子,37000101,まぁ見てる分には面白いですけど、<br>今後突然暴走しないと良いですね……。,1,21,
#,,,#END,

