#ID,名称,CharaID,メッセージ,ボイスID,表情差分,エモーション,
#,,,チャプター26：病院　ラストオーダー　御坂妹　,,,,
#,,,直接聞いてほしい！,
1,打ち止め,22000101,っていうことがあったの。って、ミサカはミサカは<br>昨日の出来事の顛末を詳細に説明してみたり。,900220029,13,
2,御坂妹,21000101,ですからそれは、ネットワークを介して既に配信されて<br>いますのでわざわざ口頭での報告は必要ないのでは。,900210015,10,
3,御坂妹,21000101,と、ミサカはめんどくさそうに再度指摘します。,0,11,ef_com_00100_002_006_00,
4,打ち止め,22000101,あえて口頭で言いたいの！<br>って、ミサカはミサカは主張してみたり！,900220025,13,
5,御坂妹,21000101,心底どうでも良い痴話喧嘩を何度もこと細かに知らされる<br>こちらの身にもなってください。,0,10,
6,御坂妹,21000101,と、ミサカは迷惑だという気持ちを隠さず<br>あえてストレートに意見します。,900210016,11,ef_com_00100_002_006_00,
7,打ち止め,22000101,いいから聞いてよ！　大事にとっておいたプリンを<br>あの人に食べられちゃったの～！,900220026,13,ef_com_00100_002_005_00,
8,打ち止め,22000101,って、ミサカはミサカは愚痴りたい～！,0,13,
