#ID,名称,CharaID,メッセージ,ボイスID,表情差分,エモーション,
#,スポット会話,,チャプター17：常盤台中学　白井 黒子　婚后 光子　,
#,,,編み物は大変,0,
1,白井 黒子,5000101,失礼しますの！　お掃除の時間なので、教室を開けて<br>くださいませ！　……て、婚后さん？,900050001,10,ef_com_00100_002_001_00,
2,婚后 光子,9000101,あ、白井さん……あ、あの！　五分待って<br>頂けませんこと？　やんごとなき事情がありますの！,900090001,10,
3,白井 黒子,5000101,はあ、構いませんけど、やんごとなき事情とやら、<br>説明して欲しいですの。,900040015,14,
4,婚后 光子,9000101,そ、それはその……編み目を落としてしまいまして。<br>今立ち上がると数が分からなくなりますのよ！,900090017,17,ef_com_00100_002_003_00,
5,白井 黒子,5000101,へー、婚后さん、編み物なんかなさるんですの。<br>なんか意外ですの。,900050003,15,
6,婚后 光子,9000101,ま、そう経験があるわけではございませんけど。<br>基本的にこの婚后光子に不可能はありませんのよ。,900090002,11,ef_com_00100_002_007_00,
7,白井 黒子,5000101,豪語する割に編み目落としてるじゃないですの。<br>まあわかったから、さっさと数えなおして欲しいですの。,900050004,10,
8,婚后 光子,9000101,恩に着ましてよ。えっと、一〇段目のこの編み目の……<br>隣の目を……えっと……。,900090014,20,
9,白井 黒子,5000101,なにやらご苦労なさってるようですけど。<br>ちなみに、それ、何を編んでますの？,900050004,10,ef_com_00100_002_002_00,
10,婚后 光子,9000101,は、話しかけられると手元が狂いましてよ！<br>御坂さんへの日頃のお礼のプレゼントですのよ！,900090025,13,ef_com_00100_002_003_00,
11,白井 黒子,5000101,今、なんとおっしゃったんですの……？,900050017,15,
12,婚后 光子,9000101,ですから御坂さんへのプレゼントですのよ！　ケロ蔵？<br>とやら、お好きとのことですのでその柄のミトンを……。,900090003,10,
13,白井 黒子,5000101,なななななんたる抜け駆けをぉおおお！<br>気が変わりましたの！　さー掃除するからどいてですの！,900050025,13,ef_com_00100_002_005_00,
14,婚后 光子,9000101,な、なんですのいきなり！　なんたる不当！<br>あああ、編み目が最早収拾がつきませんことよー！,900090020,13,
15,白井 黒子,5000101,このわたくしをさしおいてお姉様へのプレゼントなど<br>企むからですのよ～！,900050021,20,ef_com_00100_002_005_00,
