#ID,名称,CharaID,メッセージ（全角26文字x2行）,ボイスID,表情差分,エモーション,
#,,,ストーリーイベント: とある幻想の一周記念[後編] チャプター01,
#,,,一方そのころ,
#,,,#【学園都市・路上Ａ・昼】,
1,打ち止め,22000101,むすーっ！<br>ってミサカはミサカは膨れてみたり！,1,13,ef_com_00100_002_005_00,
2,一方通行,13000201,なにいきなり膨れてンだ。<br>フグの物真似大会でもあンのか？,1,22,,
3,打ち止め,22000101,違うよ！　これは怒ってるアピールなの！<br>ってミサカはミサカはもっと頬を膨らませてみたり。,1,13,
4,一方通行,13000201,アァ？<br>怒ってるって何にだ。,1,15,ef_com_00100_002_002_00,
5,打ち止め,22000101,だって、せっかく一周年記念で<br>学園都市から海外旅行の招待が来てたんだよ？,1,16,
6,打ち止め,22000101,それなのにあなたってば、<br>あの招待を断っちゃうんだもん！,1,16,
7,打ち止め,22000101,一体どういうつもりなの！<br>ってミサカはミサカは問い詰めてみたり！,1,16,
8,一方通行,13000201,別にどういうつもりもねェよ。<br>行くのが面倒だから行かなかっただけだ。,1,20,
9,一方通行,13000201,なンだ、旅行に行けなかったことを怒ってンのか。<br>別に怒るようなことじゃねェだろ。,1,20,
10,打ち止め,22000101,怒るようなことだよ！　ミサカも海外旅行行きたい！<br>ってミサカはミサカは力説してみたり！,1,13,ef_com_00100_002_005_00,
11,一方通行,13000201,旅行ならもうロシアに行ったろ。<br>それで満足しとけ。,1,11,
12,打ち止め,22000101,ロシアには行ったけど……あれって旅行？<br>ってミサカはミサカは首をかしげてみたり。,1,14,ef_com_00100_002_002_00,
13,打ち止め,22000101,旅行って言うのはもっと楽しいものじゃないかな！<br>ってミサカはミサカは旅行の定義について語ってみたり。,1,10,
14,一方通行,13000201,はァ……。そンなに行きたきゃ<br>今回の旅行に参加すりゃ良かっただろ。,1,22,
15,一方通行,13000201,現に黄泉川に芳川。<ruby>番外個体</ruby>も行ってンだろ？<br>そいつらについてけば良かったじゃねェか。,1,22,,
16,一方通行,13000201,そうしなかったのはオマエの勝手だ。<br>それでダダ捏ねられても――,1,22,
17,打ち止め,22000101,それじゃダメなんだよ。,1,14,
18,一方通行,13000201,……アァ？,1,15,ef_com_00100_002_002_00,
19,打ち止め,22000101,もう！<br>ミサカはあなたと一緒に旅行に行きたいの！,1,16,
20,打ち止め,22000101,だから、あなたが行かなかったら意味ないんだよ！<br>ってミサカはミサカは訴えてみたり！,1,16,
21,一方通行,13000201,……チッ。<br>面倒くせェな……。,1,16,ef_com_00100_002_006_00,
22,一方通行,13000201,……いつか気が向いたら、行ってやる。,1,14,
23,打ち止め,22000101,本当！？　いつか、絶対だよ！,1,15,ef_com_00100_002_001_00,
24,打ち止め,22000101,その時は楽しい思い出いっぱい作ろうね！<br>ってミサカはミサカは未来に思いを馳せてみたり！,1,12,
25,一方通行,13000201,気が向いたらって言ったろ。<br>勘違いすンじゃねェ。,1,20,
26,打ち止め,22000101,うん。けど楽しみにしてる。<br>ってミサカはミサカは未来にワクワクしてみたり。,1,21,ef_com_00100_002_007_00,
27,打ち止め,22000101,それにしても……ロシアかぁ。<br>ふふっ。,1,12,
28,一方通行,13000201,……なンだ。その笑いは。,1,20,
29,打ち止め,22000101,ちょっとロシアのことを思い出してたの。<br>ってミサカはミサカは昔を懐かしんでみたり。,1,11,
30,一方通行,13000201,未来に行ったり過去に行ったり。<br>忙しい奴だな。,1,20,
31,一方通行,13000201,つーか、ロシアでそんな笑う事あったかァ？<br>旅行に行ったわけでもねェし。,1,20,
32,打ち止め,22000101,確かに大変なことはいっぱいあったよ。<br>でもね……。,1,10,
33,打ち止め,22000101,ミサカのためにあなたが<br>ロシアまで一緒に行って助けてくれたり。,1,10,
34,打ち止め,22000101,一緒にいたいってお願いしたら<br>ちゃんとあなたが戻ってきてくれたり。,1,10,
35,打ち止め,22000101,そんないい思い出も沢山あったんだよ！　ミサカは<br>ミサカはあの時のことを思い出して感動してみたり！,1,12,
36,一方通行,13000201,……そォかよ。,1,11,
37,打ち止め,22000101,あ、今ちょっとミサカネットワークに通信が……。,1,15,ef_com_00100_002_001_00,
38,打ち止め,22000101,詳しい話は小説の<ruby=だいにじゅうにかん>第㉒巻</ruby>か、<br>『とある魔術の<ruby>禁書目録</ruby>Ⅲ』の２６話目を見てだって。,1,10,,
39,打ち止め,22000101,……これなに言ってるかあなたわかる？<br>ってミサカはミサカはちんぷんかんぷんだったり。,1,14,ef_com_00100_002_002_00,
40,一方通行,13000201,俺に聞くな。<br>わけわかンねェ話はスルーしとけ。,1,20,
41,打ち止め,22000101,わかった！<br>ってミサカはミサカは頷いてみたり！,1,10,
42,打ち止め,22000101,あ、そういえば！　ロシアといえばあれが綺麗だった！<br>ってミサカはミサカは思い出してみたり！,1,15,ef_com_00100_002_001_00,
43,一方通行,13000201,綺麗なもン？<br>なンだ、雪景色でも思い出したか？,1,15,ef_com_00100_002_002_00,
44,打ち止め,22000101,違うよ。ミサカを助けてくれたときのあなた、<br>白い羽がばーって広がって凄く綺麗だったなぁって。,1,10,,
45,打ち止め,22000101,まるで天使様みたいだったなぁ……。<br>ってミサカはミサカはうっとり思い出に浸ってみたり。,1,10,
46,一方通行,13000201,天使みたいか……。<br>まァ、人から白い羽が生えてりゃそう見えるかもな。,1,11,
47,打ち止め,22000101,あの姿、もう一回見てみたい！<br>ってミサカはミサカはおねだりしてみたり！,1,12,,
48,一方通行,13000201,どこぞの三下じゃねェンだ。<br>あンなメルヘンな姿そうそう見せられるか。,1,20,
49,一方通行,13000201,馬鹿な事言ってねェで、とっとと帰るぞ。,1,20,
50,打ち止め,22000101,あ、待って待って！<br>ってミサカはミサカは駆け足で追いかけてみたり～！,1,15,ef_com_00100_002_003_00,
#,,,#END,





















