#ID,名称,CharaID,メッセージ,ボイスID,表情差分,エモーション,
#,
#,,,得体の知れない怪物を討伐せよ,,,,
#,,,#【公園・内部C・夜】,
1,得体の知れない怪物,536000106,グァァァッ……。,1,10,
2,初春 飾利,36000101,す、すごい。あの二人が来たとたん<br>あんなあっさり……。,1,15,ef_com_00100_002_004_00,
3,佐天 涙子,37001201,あのお二人もヘスティアさん達の世界の人ですよね？<br>そっちの世界ではみんなあんなに強いんですか？,1,15,,
4,ヘスティア,181000101,ふっふっふっー。,1,12,ef_com_00100_002_000_00,
5,ヘスティア,181000101,ベル君達が強いのは、ボク達神が眷族である子ども達に<br>与えている力『<ruby=ファルナ>神の恩恵</ruby>』の影響もあるのさ！,1,10,,
6,インデックス,2000101,神様から直接与えられる<ruby=ギフト>祝福</ruby>……。<br>それならあの力も納得なんだよ。,1,10,,
7,佐天 涙子,37001201,もしかしてそれがあれば、<br>あたし達もあれくらい強くなったりするんですか？,1,10,
8,ヘスティア,181000101,いや、そんなことはないよ。<br>その後どうなるのかは<ruby=こども>眷族</ruby>達次第さ。,1,11,,
9,ヘスティア,181000101,戦い冒険して強くなる。特にあのヴァレン何某君は<br>レベル６の第一級冒険者なんだ。,1,12,
10,御坂 美琴,4000102,へぇ、レベルなんてあるんだ。<br>なんだか私達の能力と似たようなとこがあるわね。,1,10,,
11,ベル,180000701,御坂さんも上条さんも強かったです。,1,10,,
12,ベル,180000701,それにあの電撃のような技……。<br>この世界にも『<ruby=ファルナ>神の恩恵</ruby>』に似た何かがあるんですか？,1,10,,
13,御坂 美琴,4000102,それが何かはよく分からないけど、この学園都市では<br>超能力の開発が行われているのよ。,1,11,
14,ベル,180000701,あの電撃の正体は超能力……。<br>僕でも何か超能力を授けてもらえるのでしょうか？,1,10,
15,ヘスティア,181000101,べーるーくーん？<br>浮気は駄目だよ、浮気は！,1,23,ef_com_00100_002_006_00,
16,ベル,180000701,そ、そういうのじゃないですよ！<br>ただ、今より強くなれたらなって。,1,22,ef_com_00100_002_003_00,
17,御坂 美琴,4000102,能力開発は結構時間かかるし、<br>それに学園都市の学生じゃないと受けられないわよ。,1,11,
18,ベル,180000701,ああ……それだと僕達は<br>超能力を授けてもらえそうもありませんね……。,1,14,ef_com_00100_002_004_00,
19,リュー,183000701,話を遮ってすみませんが、<br>今後の方針はどうしますか？,1,10,,
20,ベル,180000701,アイズさん、リューさん。<br>実は僕達一つ気づいたことがあって……。,1,10,
#,,,【時間経過】,
21,ベル,180000701,ということなんです。,1,10,
22,アイズ,182000701,あのモンスターが私達の世界に帰るためのヒント。,1,11,
23,白井 黒子,5000101,問題はそのモンスターが<br>どこにいるかということなのですが……。,1,10,,
24,リュー,183000701,そういうことであれば。公園に<br>モンスターが多数集まっているようでした。,1,10,
25,ヘスティア,181000101,本当かい！？　ということは……,1,15,ef_com_00100_002_001_00,
26,白井 黒子,5000101,光る穴は公園にある可能性が高い。<br>ということですわね。,1,11,,
27,ヘスティア,181000101,よし、そうとわかれば<br>早速公園に行ってみよう！,1,10,
#,,,【暗転】,
#,,,#【公園・内部B・夜】,
28,上条 当麻,1000101,凄いモンスターの数だな……！<br>こんな大群が街にでも出たら……。,1,15,ef_com_00100_002_003_00,
29,アイズ,182000701,……あそこ。,1,10,
30,ヘスティア,181000101,あれは……光る穴！<br>やっぱりここにあったのか！,1,15,
31,ベル,180000701,あの穴に入ればきっと元の世界に帰れる。<br>けど、その前に……！,1,13,
32,御坂 美琴,4000102,ここにいるモンスター達を一掃するわよ！,1,20,
#,,,#END,
