#ID,名称,CharaID,メッセージ（全角26文字x2行）,ボイスID,表情差分,エモーション,
#,,,ストーリーイベント: このすばコラボ[後編] チャプター04,
#,,,とある野菜の大逆襲,
#,,,#【学園都市・建設中のビル・昼】,
1,打ち止め,22000101,このあたりかな、ってミサカはミサカは<br>キョロキョロしながら尋ねてみる！,1,10,,
2,御坂妹,21000101,最新の観測情報と移動傾向からすると、この近辺での<br>発見確率が高いでしょうとミサカは分析します。,1,10,,
3,打ち止め,22000101,だったら絶対見つけてみせるって<br>目を皿のようにして観察して……,1,13,
4,打ち止め,22000101,あれ……！　見た見た見た！？　って<br>ミサカはミサカは激しく同意を求めたり！,1,15,ef_com_00100_002_001_00,
5,御坂妹,21000101,間違いなく、キャベツが空を飛んでいました、<br>とミサカは驚きながら返答します。,1,15,
6,打ち止め,22000101,やっぱり目の錯覚じゃなかったってミサカはミサカは<br>隠しきれない喜びを表現してみる！,1,21,ef_com_00100_002_007_00,
7,御坂妹,21000101,では、捕獲して証拠としましょうとミサカは<br>落ち着いて狙いを定めます。,1,11,
#,,,#【時間経過】,
8,御坂妹,21000101,ふっ！　空飛ぶキャベツ確保しました。,1,12,
9,打ち止め,22000101,おっしゃー！　これであの人をぎゃふんと<br>言わせられるってミサカはミサカは勝利を確信してみる！,1,20,ef_com_00100_002_000_00,
10,御坂妹,21000101,ところで、それ以外にも一つ発見があったことを<br>ミサカは真面目に報告します。,1,10,
11,打ち止め,22000101,これは……？　なんだか妙な感じがするって<br>ミサカはミサカは第六感を発揮してみたり。,1,15,ef_com_00100_002_002_00,
12,御坂妹,21000101,謎の箱です、とミサカは見たままを淡々と伝えます。,1,10,
13,打ち止め,22000101,うーん？　キャベツが持ってたのかなって<br>ミサカはミサカは適当にいじってみたり。,1,10,,
14,打ち止め,22000101,えっ、えっ、きゃ、キャベツが沢山沢山出てきたよ！？,1,15,ef_com_00100_002_003_00,
15,御坂妹,21000101,離れてください、とミサカはうかつな行動をとる上司を<br>たしなめるように伝えます。,1,15,ef_com_00100_002_003_00,
16,打ち止め,22000101,ど、ど、どんどん出てくるよ！　<br>ってミサカはミサカは慌ててみたり！,1,15,
17,御坂妹,21000101,この数はいささか危険です。撤退しましょう、とミサカは<br>箱に触ったことは責めずに適切な提案をします。,1,13,
#,,,#【時間経過】,
18,御坂妹,21000101,一匹一匹焼いて落としても全く意に介さないキャベツに<br>ミサカはいささかうんざりだと伝えます。,1,14,ef_com_00100_002_006_00,
19,打ち止め,22000101,焼けたキャベツの匂いがちょっと美味しそうに思いながら<br>ミサカはミサカは数の恐怖におののいてみる！,1,14,
20,御坂妹,21000101,一つくらい味見してみますか？　とミサカは勇気ある<br>提案をしてみます。,1,10,
21,打ち止め,22000101,そ、それどころじゃないよ！　ってミサカはミサカは<br>必死で逃走を続けてみる！,1,15,ef_com_00100_002_003_00,
#,,,#【時間経過】,
#,,,#【学園都市・路上Ａ・昼】,
22,御坂妹,21000101,――？,1,15,ef_com_00100_002_001_00,
23,打ち止め,22000101,ど、どうかしたのってミサカはミサカは<br>不安混じりに尋ねてみる！,1,15,ef_com_00100_002_002_00,
24,御坂妹,21000101,いえ。キャベツだけかと思っていたら――。,1,15,
25,御坂妹,21000101,レタスが交じっていましたとミサカは驚きを伝えます。,1,15,
26,打ち止め,22000101,ど、どうでもいいんじゃないかなって<br>ミサカはミサカは全力で突っ込んでみる！,1,15,ef_com_00100_002_003_00,
27,御坂妹,21000101,キャベツとレタスは全くの別種であるためこれは犬と猫が<br>群れを成すようなこととミサカは不思議さを強調します。,1,15,
#,,,#【時間経過】,
#,,,#【学園都市・路地裏・昼】,
28,打ち止め,22000101,あっ……！？　い、行き止まり……！？,1,15,ef_com_00100_002_003_00,
29,御坂妹,21000101,攻撃に気を取られて、先の地形を把握することを<br>怠りましたとミサカは素直に認めます。,1,14,
30,打ち止め,22000101,ところでアレってどうして襲ってくるんだろうって<br>ミサカはミサカは今更ながら疑問を呈してみる！,1,14,ef_com_00100_002_002_00,
31,御坂妹,21000101,今までに食われてきた仲間の恨みを晴らすためというのは<br>どうでしょうとミサカはホラー調に推測します。,1,10,
32,打ち止め,22000101,ひ、ひいっ！　た、食べられる！？<br>ミ、ミサカはミサカは心底恐怖してみたり！,1,15,ef_com_00100_002_003_00,
33,一方通行,13001001,まったく、なァにやってンだ……。,1,16,,
34,打ち止め,22000101,あっ……！,1,15,
#,,,#END,






































































