#ID,名称,CharaID,メッセージ（全角26文字x2行）,ボイスID,表情差分,エモーション,
#,,,ストーリーイベント: とある天衣の夏色追想 チャプター08,
#,,,水には水着を,
#,,,#【公園・内部C・昼】,
1,不良Ｂ,504000106,へへっ、大量大量！<br>今回もうまくいったな。,905040032,12,,
2,不良Ａ,516000106,ああ、世間知らずのお嬢様なんてチョロいもんだ。<br>後はこれを売っぱらって……。,905040002,12,,
3,固法 美偉,35000101,見つけたわ！　あなた達、大人しくしなさい！<br><ruby>風紀委員</ruby>よ！,900350028,13,,
4,不良Ａ,516000106,<ruby>風紀委員</ruby>だと！？<br>どうしてここが……！,905040017,15,ef_com_00100_002_003_00,
5,固法 美偉,35000101,洗車場ならトラックが停まっていても自然だと<br>思ったのでしょうが、私の能力なら関係ないわ。,900350005,13,
6,不良Ａ,516000106,チッ！　<ruby>透視能力</ruby>か何かか！<br>お前ら、ズラかるぞ！,905040024,13,ef_com_00100_002_006_00,
7,固法 美偉,35000101,あ、待ちなさい！,900350030,15,
8,不良Ａ,516000106,へっ、何人かは捕まるかもしれないが、<br>俺さえ逃げ延びればまだやり直すチャンスは……。,905040002,12,
9,帆風 潤子,93000101,見つけましたわ！<br>貴方達が水着泥棒ですわね！,900930028,13,,
10,不良Ａ,516000106,なっ……お前、さっきの常盤台の……。,905040030,15,ef_com_00100_002_003_00,
11,帆風 潤子,93000101,トラックが多くて見つけられませんでしたが、<br>こうして出て来たなら話は別。,900930005,13,
12,帆風 潤子,93000101,わたくし達の……女王の水着を<br>返してもらいますわ！,900930021,13,
13,固法 美偉,35000101,どうやら挟み撃ちになったみたいね。,900350011,13,
14,不良Ａ,516000106,チッ、前に常盤台の女。<br>後ろに<ruby>風紀委員</ruby>かよ……！,905040026,13,,
15,帆風 潤子,93000101,逃げ場はないわよ。<br>諦めて捕まりなさ――。,900930021,13,
16,不良Ａ,516000106,へっ、捕まってたまるか！<br>これでも食らいやがれ！,905040021,12,
17,帆風 潤子,93000101,きゃあっ！？　ホースから水が！？,900930017,15,ef_com_00100_002_003_00,
18,不良Ａ,516000106,はははっ！　これだけの水を浴びれば<br>お前達の服なんて透けちまうだろうな！,905040002,12,
19,不良Ａ,516000106,そんな恥ずかしい格好で<br>俺達を追いかけることができるかな？,0,12,
20,固法 美偉,35000101,それは、ちょっと躊躇しちゃうかもね。<br>けど――！,900350008,13,
21,帆風 潤子,93000101,そちらがその手にでるなら。<br>こうするまでですわ！,900930004,13,
#,,,#【暗転】,
22,不良Ａ,516000106,なっ、なにぃ！？,905040030,15,ef_com_00100_002_003_00,
23,帆風 潤子,93000701,ふふっ！　どうですか。<br>服の下に水着をきていたんですの。,900930002,12,,
24,固法 美偉,35000701,これなら、どれだけ水を浴びようと関係ないし、<br>水着だもの。誰かに見られても問題ないわ！,900350006,13,,
25,不良Ａ,516000106,お前ら、なぜ水着を……。,905040022,14,ef_com_00100_002_002_00,
26,帆風 潤子,93000701,プールに行ったとき、<br>女王をお待たせするわけにはいきませんわ。,900930005,10,
27,帆風 潤子,93000701,それに女王が選んでくださった水着ですもの。<br>今日は一日中着てるって決めたんですよ。,900930002,12,ef_com_00100_002_000_00,
28,固法 美偉,35000701,私は単純に、盗られないようによ。,900350005,11,
29,不良Ａ,516000106,チィッ……！　こいつら……味な真似を。<br>こうなったら力ずくでも通らせてもらうぜ！,905040024,13,
30,帆風たち,,「やれるものならやってみなさい！」,
#,,,#END,



































































