#ID,名称,CharaID,メッセージ,ボイスID,表情差分,エモーション,
#,スポット会話,
#,
1,御坂 美琴,4000102,よし、決めた。この鮭茶漬け頼んじゃおっと。,900040006,10,ef_com_00100_002_000_00,
2,初春 飾利,36000101,へ？　鮭茶漬けですか？,900360003,15,ef_com_00100_002_002_00,
3,御坂 美琴,4000102,うん。ほら見て、美味しそうじゃない？,900040006,11,,
4,佐天 涙子,37000101,……確かに美味しそうですけど、いきなり食事系の<br>オーダーですね。お腹空いてるんですか？,900370005,10,,
5,御坂 美琴,4000102,そーなのよ。今日、午後体育があってさー。<br>なーんか小腹が空いちゃってるのよねー。変かな？,900040002,14,
6,初春 飾利,36000101,……いえ、なんか御坂さんらしくて、いいと思います！,900360008,10,
7,佐天 涙子,37000101,確かに、初春の言う通りだねー。放課後にサラサラ茶漬け<br>かっ込んじゃう感じも、なんかいいよね御坂さん。,900370006,12,
8,御坂 美琴,4000102,べ、別に、褒められるようなことじゃないわよ……。,900040022,15,
9,佐天 涙子,37000101,いーえ。天下の常盤台の<ruby>超電磁砲</ruby>がですよ？　その可憐な<br>容姿で、放課後にお茶漬けをサラサラ。……いい。,900370010,21,
10,初春 飾利,36000101,なんかいいですよね、自然で、気取りがなくて。<br>御坂さんってそういうところもカッコいいです！,900360010,12,
11,御坂 美琴,4000102,いやいやいやいや……褒めすぎでしょ……。,900040017,17,ef_com_00100_002_003_00,
12,佐天 涙子,37000101,いえ、あたしが推理するに、そんな御坂さんの姿を見て<br>惚れ込んでる男性、結構いると思いますよ？,900370008,10,
13,御坂 美琴,4000102,何言ってんの。放課後にお茶漬け食べてるだけで<br>惚れてもらえたら、こんなに苦労しないわよー。ったく。,900040024,11,
14,佐天 涙子,37000101,……聞き捨てならない、今の発言。と言うことは、誰かに<br>惚れて欲しくて現在進行中で苦労中ってことですよね？,900370029,21,ef_com_00100_002_001_00,
15,初春 飾利,36000101,ふ、ふぇええ、ホントだぁ！　そ、その誰かって……？,900360017,17,ef_com_00100_002_001_00,
16,御坂 美琴,4000102,……ちょ、佐天さん、何その誘導尋問！　いないいない、<br>そんなヤツいない！　さー、お茶漬け食べよっ！,900040017,17,ef_com_00100_002_003_00,
17,佐天 涙子,37000101,ありゃりゃ、誤魔化されちゃった。<br>……じゃ、今の続きはお茶漬けの後に♪,900370011,17,ef_com_00100_002_000_00,
