#ID,名称,CharaID,メッセージ,ボイスID,表情差分,エモーション,
#,
#,,,共同戦線,,,,
#,,,#【謎の施設・廊下・室内ライト】,
1,黒服Ａ,508000106,侵入者だ、これ以上進ませるな！,1,13,,
2,御坂 美琴,4002801,ふっ！,1,13,,
3,白井 黒子,5001401,ここはお姉様が通る道、おどきなさい！,1,13,,
4,黒服Ｂ,508000106,ぐあっ！？,1,16,ef_com_00100_002_003_00,
5,黒服Ａ,508000106,くっ、何だコイツら……！？,1,15,ef_com_00100_002_004_00,
6,七草 真由美,215000101,あら、私達のことも忘れちゃだめよ！,1,13,,
7,黒服Ａ,508000106,ぐっ……――。,1,16,,
8,白井 黒子,5001401,敵の第一陣はこれで片付きましたわね。<br>数が多いだけで大した事ありませんの。,1,10,
9,七草 真由美,215000101,けど、私達には時間があまり残されていないわ。<br>研究所内の探索のことも考えると……。,1,11,ef_com_00100_002_006_00,
10,初春 飾利,36002801,――研究所のハッキング、完了しました！<br>これでどこに何があるか分かるようになりましたよ。,1,13,,
11,北山 雫,213000101,えっ？　もうそこまで出来ちゃうなんて……。<br>正直ビックリ。,1,15,,
12,光井 ほのか,214000101,初春さんすごい！　本当にプロ級の腕前だったんだね！,1,12,ef_com_00100_002_000_00,
13,初春 飾利,36002801,えへへ、皆さんのお役に立ちたくて頑張っちゃいました。,1,12,ef_com_00100_002_000_00,
14,七草 真由美,215000101,ナイスよ初春さん！　うちの学校にいたら<br>間違いなく生徒会に勧誘していたくらい有能ね！,1,12,ef_com_00100_002_000_00,
15,初春 飾利,36002801,えへへへへ、有能だなんてそんな～。あ、施設内の<br><ruby>駆動鎧</ruby>などの警備配置も皆さんに共有しておきますね。,1,12,ef_com_00100_002_000_00,
16,初春 飾利,36002801,あと電子ドアのロックも解除しておきます。<br>それでも開かないのは私が直接開けますので。,1,12,
17,白井 黒子,5001401,て、照れながらエグい事をしてますわね……。,1,15,ef_com_00100_002_004_00,
18,御坂 美琴,4002801,初春さんいつも以上に頑張ってるわね。<br>私達も負けてられないわよ。,1,10,
19,北山 雫,213000101,後ろから敵がたくさん近づいてきてるよ。<br>応援を呼ばれたみたい。,1,10,
20,御坂 美琴,4002801,っ……前からも敵がうじゃうじゃと……！<br>時間も無いってのに挟み撃ちなんかされたら……。,1,20,ef_com_00100_002_003_00,
21,白井 黒子,5001401,お姉様、ご安心を。ここは黒子にお任せください。,1,11,
22,北山 雫,213000101,……白井さん、まさかここに残るつもり？,1,15,ef_com_00100_002_002_00,
23,白井 黒子,5001401,そのまさかですのよ。<br>さぁ、わたくしの事は気にせず進んでくださいませ。,1,10,
24,御坂 美琴,4002801,……分かった、頼んだわよ。,1,11,
25,七草 真由美,215000101,み、美琴さん！？　そんなあっさりと……。,1,15,ef_com_00100_002_003_00,
26,御坂 美琴,4002801,黒子が安心して任せろって言うなら大丈夫よ。<br>アイツのこと、信じてるから。,1,10,
27,七草 真由美,215000101,だけどたった一人で食い止めるなんて――。,1,15,ef_com_00100_002_004_00,
28,光井 ほのか,214000101,さ、七草先輩！　私達もここに残ります！,1,13,,
29,北山 雫,213000101,私達三人なら、<br>絶対に食い止めることができる。,1,13,
30,七草 真由美,215000101,……分かったわ。白井さんを頼んだわよ、二人共。,1,11,
31,ほのかたち,,「はい！」,1,,,
32,七草 真由美,215000101,初春さん、この先の案内をお願いしていい？,1,10,ef_com_00100_002_002_00,
33,初春 飾利,36002801,はい、任せてください……！,1,13,
34,御坂 美琴,4002801,それじゃ、黒子。行って来るわ。,1,10,
35,白井 黒子,5001401,はい、行ってらっしゃいませお姉様。,1,10,,
36,白井 黒子,5001401,光井さん、北山さん。<br>協力感謝いたしますわ。,1,11,
37,光井 ほのか,214000101,せっかく知り合えた仲間だもん。<br>放っておく訳にはいかないからね。,1,12,
38,北山 雫,213000101,白井さんと御坂さんって本当に仲が良いんだね。<br>迷わず白井さんに任せてたし。,1,10,
39,白井 黒子,5001401,昔は何かと一人で背負う御方でしたが、<br>徐々にわたくし達を頼るようになってくれてますのよ。,1,10,
40,白井 黒子,5001401,お姉様が今ではこんなに信頼してくださるように……。<br>黒子はお姉様の変化を嬉しく思いますの。,1,11,
41,光井 ほのか,214000101,白井さんって御坂さんの事をすごく慕ってるんだね。,1,12,
42,北山 雫,213000101,そうなった経緯とか色々聞きたいな。<br>二人の事、もっと教えてもらっていい？,1,10,
43,白井 黒子,5001401,ええ構いませんわ。ただし、お姉様のお話でしたら<br>一晩などでは収まりませんので、いずれまたゆっくりと。,1,12,ef_com_00100_002_007_00,
44,光井 ほのか,214000101,えぇ～！？　そんなに語る事があるの！？,1,15,ef_com_00100_002_003_00,
45,北山 雫,213000101,何もかも落ち着いてからじゃないと無理そうだね。,1,15,ef_com_00100_002_004_00,
46,白井 黒子,5001401,さぁ、お姉様のためにも<br>この黒子、しっかり使命を果たしてみせますわ！,1,13,
#,,,#END,
