#ID,名称,CharaID,メッセージ（全角26文字x2行）,ボイスID,表情差分,エモーション,
#,,,ストーリーイベント: 4周年メタ話シナリオ チャプター07,
#,,,主催の気配り,,,,
#,,,【学園都市／セブンスミスト／室内ライト】,,,,
1,アレイスター,203000101,それなら、選びやすくしてやろうではないか。,1,12,,
2,上条 当麻,1000101,あ、アレイスター！？,1,15,ef_com_00100_002_001_00,
3,オティヌス,45000701,何故貴様が！？,1,24,
4,アレイスター,203000101,……何を分かりきったことを。<br>この学園都市での四周年パーティーだぞ。,1,11,
5,アレイスター,203000101,私が噛んでいないわけが無かろう。<br>というか、私が主催だ。,1,10,
6,上条 当麻,1000101,あ、いやそういう事ではなく……。,1,21,ef_com_00100_002_004_00,
7,アレイスター,203000101,あぁ、私がここにいる理由か？,1,20,
8,アレイスター,203000101,決まっているだろう。<br>水着を買いに来ている。,1,10,
9,アレイスター,203000101,せっかく私が手配した、<br>『ドキッ水着だらけの周年パーティー』だぞ。,1,10,
10,アレイスター,203000101,主催が水着にならずしてどうする。<br>なによりも私だって水着を着たい。,1,10,
11,アレイスター,203000101,それとも……まさか、<br>前の姿の私での水着がご所望なのか？,1,12,ef_com_00100_002_002_00,
12,アレイスター,203000101,だとしたら、なかなか拗れているじゃないか。,1,12,,
13,上条 当麻,1000101,だーっ！！　そうじゃなくて、<br>そもそも、なぜその姿になってるかって話で……。,1,15,ef_com_00100_002_003_00,
14,アレイスター,203000101,細かいことを気にするな。<br>こういう時は何事も楽しまなければな。,1,20,,
15,アレイスター,203000101,そして、ゲスト全員が満足できるようにするのも<br>主催たる私の務めというものだ。,1,20,
#,,,ホワイトアウト,,,,
#,,,【学園都市／セブンスミスト／室内ライト】,,,,
#,,,何かしらの魔法で、オティヌスが大きくなった演出です。,
16,オティヌス,45000101,おぉ！,1,15,ef_com_00100_002_000_00,
17,アレイスター,203000101,だからこういった事も今は可能だ。,1,12,
18,上条 当麻,1000101,おいおい……。,1,21,ef_com_00100_002_004_00,
19,アレイスター,203000101,さて、元魔神の水着選びだったか？,1,10,
20,アレイスター,203000101,少年が言う、「女の子の水着を選ぶべき、<br>センスの良い女の子」が現れたわけだし。,1,10,
21,アレイスター,203000101,その少年の性癖を熟知している私なら<br>水着を選ぶには適任であろうが……。,1,12,
22,アレイスター,203000101,まぁ、せっかくの機会を邪魔するような野暮はしまい。<br>つかの間の余興を楽しんでおくんだな。,1,12,ef_com_00100_002_000_00,
23,アレイスター,203000101,私は私で自分の水着選びに行くとするさ。,1,12,,
24,上条 当麻,1000101,おい、アレイスターちょっと待て！,1,15,,
25,オティヌス,45000101,ま、待て、人間！　追ってはダメだ！,1,20,,
26,上条 当麻,1000101,！？　どうした、何かあったのか！？,1,10,ef_com_00100_002_002_00,
27,オティヌス,45000101,あぁもっと重要なことが……。,1,11,,
28,上条 当麻,1000101,……。,1,23,,
29,オティヌス,45000101,それは、私の予想が当たっていたという事だ。<br>さぁ懸念はなくなったな。,1,12,
30,オティヌス,45000101,思う存分私の水着を選ばせてやるぞ！,1,12,ef_com_00100_002_000_00,
#,,,［END］,


































































































