#ID,名称,CharaID,メッセージ（全角26文字x2行）,ボイスID,表情差分,エモーション,
#,,,ストーリーイベント: 学園都市の夏休み チャプター9,
#,,,失った思い出を再び,,,,
#,,,#【学園都市外部・砂浜・夕】,,,,
1,上条 当麻,1000401,あー、もう日が暮れるくらい時間が経ったってのに、<br>インデックスに噛まれた頭がまだ痛ぇ……。,900010027,16,ef_com_00100_002_006_00,
2,五和,30000401,私の方からも、うまく説明できれば良かったんですが……<br>またもやお役に立てず、すいませんでした。,900300013,14,ef_com_00100_002_006_00,
3,上条 当麻,1000401,いや、バランス崩して五和に倒れかかったのは俺だし。<br>五和は気にしなくても大丈夫だぞ。,900010007,11,
4,上条 当麻,1000401,さてと、少しは痛みも引いてきたし。俺に怒って<br>白井達と一緒にいるインデックスを迎えに行くとするか。,900010003,10,
5,五和,30000401,あ、あの！　この後の予定はありますか？,900300029,17,ef_com_00100_002_003_00,
6,上条 当麻,1000401,え？　そうだな……インデックスを迎えに行ったら、<br>機嫌を直してもらうために晩メシに連れてく、くらいか。,900010006,10,ef_com_00100_002_002_00,
7,五和,30000401,でしたら、今回のお礼としてバーベキューを<br>ご馳走したいのですが、いかがでしょう？,900300004,12,
8,上条 当麻,1000401,良いのか？　別にそこまで気を遣わなくても……。,900010009,15,ef_com_00100_002_001_00,
9,五和,30000401,いえいえっ、是非！　インデックスさんや、<br>巻き込んでしまった皆さんもお誘いしたいので！,900300007,10,
10,上条 当麻,1000401,そっか、そういう事ならお言葉に甘えようかな。,900010002,12,
11,五和,30000401,はい、ありがとうございます！　今から皆さんを誘って、<br>それから食事にしますので、少しの間待っててください！,900300005,12,ef_com_00100_002_000_00,
12,上条 当麻,1000401,ああ、分かった。その辺でも歩いてるよ。<br>何か手伝える事があったら、いつでも呼んでくれ。,900010006,12,,
#,,,#【暗転】,
13,上条 当麻,1000401,さて、その辺を歩くとは言ったものの、<br>行く当てもねぇな……ん？　あそこにいるのは、神裂？,900010004,10,
#,,,#【イラスト表示開始】,,,,
14,上条 当麻,1000401,よっ神裂、何してるんだ？<br>一人で海を眺めてお楽しみか？,900010001,12,ef_com_00100_002_001_00,
15,神裂 火織,25000401,上条当麻ですか。<br>いえ、特に何かをしていた訳ではありませんよ。,900250001,10,
16,上条 当麻,1000401,そうなのか？　じゃあせっかくの海なんだし、<br>インデックスと遊んだりしたらどうだ？,900010004,12,
17,神裂 火織,25000401,せっかくの海だからこそ、私はあの子に近づきません。<br>私のせいで、あの子の楽しい時間を台無しにしたくない。,900250015,11,
18,上条 当麻,1000401,そんな事にはならねーと思うけどな……あ、そうだ！<br>この後、みんなでバーベキューするんだけどさ。,900010007,11,
19,上条 当麻,1000401,メシ時なら、インデックスは普段以上に機嫌が良いんだ。<br>暗くなる事なんてないし、それなら一緒にいやすいだろ？,900010002,12,
20,神裂 火織,25000401,あなたが言うなら、そうかもしれませんが……。<br>ですが、私は――。,900250008,14,ef_com_00100_002_006_00,
#,,,#【イラスト表示終了】,
#,,,#【学園都市外部・砂浜・夕】,
21,上条 当麻,1000401,グダグダ言う前にぶつかってみようぜ？<br>ほら、行こうぜ神裂。,900010018,10,
22,神裂 火織,25000401,か、上条当麻？　急に手を引かないでください。<br>まだ私は心の準備が……あっ！？　足が砂で滑って……！,900250017,20,ef_com_00100_002_003_00,
23,上条 当麻,1000401,おっと、神裂でも砂に足を取られて転んだりするんだな。<br>つか、俺が引っ張ったせいだよな、悪かった。,900010019,15,
24,神裂 火織,25000401,いえ、油断していました。<br>受け止めてもらって、感謝します。,900250014,17,
25,神裂 火織,25000401,で、ですが今はそれより……あのっ<br>距離が近くありませんか、上条当麻！？,900250030,17,
26,上条 当麻,1000401,うぉ！？　悪い、神裂！　突然だったから思いっきり<br>抱き寄せちまってた！　い、今すぐ離れるから――。,900010017,22,ef_com_00100_002_003_00,
27,御坂 美琴,4000401,（はぁ……黒子達がアイツとその友達から食事に誘われた<br>って言うから慌てて来ちゃったけど、気が重いわね……）,900040015,14,,
28,御坂 美琴,4000401,（つい、追いかけ回したりするなんて……アイツ相手でも<br>さすがにやり過ぎな気がするし、悪い事しちゃったなぁ）,0,14,ef_com_00100_002_006_00,
29,御坂 美琴,4000401,（あーもう、ダメだダメだ。せっかくの機会なんだし、<br>前向きにいきましょ。そうよ、仕切り直せば良いのよ）,900040006,11,,
30,御坂 美琴,4000401,自然に声をかけて、そのまま海辺を歩いちゃったり？<br>あははー……って、ちょっとそこで何してんのアンタ！？,900040028,20,
31,上条 当麻,1000401,えっ、何で御坂がっ！？　ご、誤解するな！？<br>これは偶然抱き合っただけであって決して故意では……！,900010030,21,ef_com_00100_002_003_00,
32,御坂 美琴,4000401,偶然でそんな風に抱き合えるかーっ！<br>公共の場でイチャついてるようにしか見えないっつの！,900040018,13,
33,神裂 火織,25000401,い、イチャついて！？　そ、それは大きな勘違いです！<br>離れてください上条当麻！　私は五和の元に向かいます！,900250017,20,,
34,上条 当麻,1000401,え、いやいや今いなくなられるのはマズいって！<br>お前が説明してくれないと……！　待ってくれ神裂ぃー！,900010018,15,ef_com_00100_002_003_00,
35,御坂 美琴,4000401,今のって、昼間に会ったアンタの知り合いの人よねぇ？<br>へぇ、あの子だけじゃなくて知り合いにも手を出す訳ぇ？,900040004,20,,
36,上条 当麻,1000401,全部誤解だっての！　だから火花を散らすのはヤメろ！？<br>ここは海だぞ、俺を感電死させるつもりか！？,900010023,14,ef_com_00100_002_006_00,
37,御坂 美琴,4000401,言い訳は結構よっ！　ここをアンタの墓場にしなさい……<br>このすけこましのド変態ヤロウがぁーっ！！,900040022,13,ef_com_00100_002_005_00,
#,,#END,






































































































































































































































































































































































































































































































































































































































































