#ID,名称,CharaID,メッセージ,ボイスID,表情差分,エモーション,
#,,,チャプター06：駅周辺　ステイル＝マグヌス　インデックス　,,,,
#,,,良い人？,
1,インデックス,2000101,あなたは良い人だね！,900020001,12,
2,ステイル,24000101,唐突だね。どうしてそう思うんだい？,900240001,10,ef_com_00100_002_002_00,
3,インデックス,2000101,美味しい食べ物をくれる人に<br>悪い人なんていないからなんだよ。,900020006,10,
4,ステイル,24000101,そういう君は、なんだかすぐに騙されてしまいそうだね。,900240004,11,
5,インデックス,2000101,むぅ、そんなことないんだよ。<br>それに私はそこそこ人を見る目はあるからね。,900020024,20,ef_com_00100_002_006_00,
6,インデックス,2000101,だからあなたはきっと良い人なんだよ。,900020002,12,ef_com_00100_002_007_00,
7,ステイル,24000101,そう……。,900240002,12,
8,ステイル,24000101,（まったく。<br>こんなに簡単に人を信じたりして先が思いやられるよ）,0,12,
9,ステイル,24000101,（まぁほんの少しだけ、嬉しいかな……）,0,10,ef_com_00100_002_000_00,

