#ID,名称,CharaID,メッセージ,ボイスID,表情差分,エモーション,
#,スポット会話,,チャプター05：公園　神裂 火織　五和　,
#,,,エプロン大作戦,
1,神裂 火織,25000101,……五和、気になっていることがあるのですが。,900250029,11,
2,五和,30000101,はい、なんでしょう、<ruby>女教皇様</ruby>。,900300005,10,
3,神裂 火織,25000101,建宮たちが話しているのを小耳に挟んだのですが、<br>五和にはその……許嫁のような方がいるのですか？,900250023,17,
4,五和,30000101,はいい？　いいなずけ？<br>いませんいません、そんなものいません！,900300018,90,ef_com_00100_002_003_00,
5,神裂 火織,25000101,そうなのですか？　『五和新妻エプロン大作戦』とか<br>なんとか、やけに興奮して議論していたのですが。,900250030,20,ef_com_00100_002_001_00,
6,五和,30000101,なんかフリッフリのエプロンが部屋に置いてあったのは<br>建宮さんたちの仕業ですか！　ホントにもー！,900300017,14,ef_com_00100_002_003_00,
7,神裂 火織,25000101,よくわかりませんがとにかく結婚の予定はないのですね？,900250003,17,
8,五和,30000101,ないです！　事実無根です！<br>結婚なんて……夢のまた夢です！,900300007,17,
9,神裂 火織,25000101,……夢のまた夢。と、言うことは、結婚を夢見ている<br>殿方はいるということですか？,900250004,10,
10,五和,30000101,……そ！　それは！　えーと、その、なんというか、<br>私なんかが相手にされるわけはないですし、その……。,900300011,90,ef_com_00100_002_003_00,
11,神裂 火織,25000101,相手にされるわけないとは？　私から見て五和ほど<br>魅力的な女性もそうはいないですよ？,900250002,12,
12,五和,30000101,いいえ、私なんて、<ruby>女教皇様</ruby>に比べたら、全然魅力の<br>カケラもないですから……。,900300015,11,ef_com_00100_002_004_00,
13,神裂 火織,25000101,はあ？　そこでなぜ私が出てくるのです？,900250030,21,ef_com_00100_002_002_00,
14,五和,30000101,だって、あのフリッフリエプロンだって、<ruby>女教皇様</ruby>が<br>お召しになったら、どれほど効果的な事か……。,900300024,17,
15,五和,30000101,私と違って隠れ扱いではない豊かなお胸が、エプロンの<br>然るべき部分を持ち上げて……ああ、とても敵いません。,900300015,11,ef_com_00100_002_006_00,
16,神裂 火織,25000101,そこでなぜ敵うとか敵わないとかの話になるのです！<br>そもそも私はエプロンなど着けませんから！,900250018,20,
17,五和,30000101,でも、メイドの恰好はなさってましたよね……？<br>あの、堕天使エロメイ……,900300008,17,
18,神裂 火織,25000101,ちょっ！　その話はしないでください！<br>とにかく！　五和は魅力的です！　以上です！,900250017,20,ef_com_00100_002_006_00,
