#ID,名称,CharaID,メッセージ（全角26文字x2行）,ボイスID,表情差分,エモーション,
#,,,科学サイドストーリー Chapter3,
#,
#,,,#【上条の学校・教室・昼】,
1,上条 当麻,1000101,うう……みんなにいじめられた……。<br>俺ってもしかして友だちいないのか？,900010012,14,ef_com_00100_002_004_00,
2,土御門 元春,3000101,あくまで被害者ヅラを通すつもりぜよ。<br>許せんよなあ、青髪の。,900030024,11,
3,青髪ピアス,48000101,ああ、そうやなあ土御門の。<br>上条当麻。モテ罪で逮捕や。観念せえ。,900480024,13,
4,上条 当麻,1000101,納得出来るかっ！,900010021,15,ef_com_00100_002_001_00,
5,月詠 小萌,6000101,そんなにお喋りしたいなら、<br>無限の猿定理したいですか～？,900060024,20,
6,上条 当麻,1000101,それ言語野をランダムに能力でイジって<br>２４時間喋らせることで物語を作るクソ実験ですよね！？,900010018,15,ef_com_00100_002_003_00,
7,月詠 小萌,6000101,だから静かにしろって言っているのです。<br>罰として上条ちゃんはアンケート集めろですよー。,900060018,13,
8,上条 当麻,1000101,へえ～い……。,900010003,10,
9,上条 当麻,1000101,ふんふん、ふんふん……。<br>……よしっ、じゃあこれお願いしま――っとぉっ！？,0,15,ef_com_00100_002_001_00,
10,月詠 小萌,6000101,わわっ！？　上条ちゃーん！？,900060017,15,ef_com_00100_002_001_00,
11,上条 当麻,1000101,すみません先生……っ！<br>だ、大丈夫ですか！？,900010013,15,ef_com_00100_002_006_00,
12,月詠 小萌,6000101,ううー、大丈夫ですけど……。<br>アンケートがバラバラに……。,900060023,16,ef_com_00100_002_003_00,
13,青髪ピアス,48000101,カミやん、平常運転過ぎるやろ。<br>小萌先生に密着とか羨ましい。,900480011,12,
14,土御門 元春,3000101,しゃーないぜい、拾うの手伝うかにゃー。,900030023,10,
15,青髪ピアス,48000101,そうするか。ええっと、なになに？　――ヤベエ。<br>白髪の男が毛布だけの幼女の手を引いてた……？,900480005,15,ef_com_00100_002_002_00,
16,土御門 元春,3000101,銀髪少女にシスターコスプレさせて、<br>部屋に居候させてるヤツがいる……？　うはっ。,900030004,15,
17,上条 当麻,1000101,おい、それ……まあいいけどよ……。,900010018,10,ef_com_00100_002_001_00,
18,吹寄 制理,8000101,あとは上条当麻に対する苦情ばかりね。<br>……それと不幸のメール？,900080005,10,ef_com_00100_002_006_00,
19,土御門 元春,3000101,ああ～、さっき騒いでたやつか。<br>流行ってるのかにゃー？,900030003,14,ef_com_00100_002_002_00,
20,上条 当麻,1000101,そもそも、どんな不幸が起きるのかって話だけどな。,900010008,10,
21,青髪ピアス,48000101,携帯のデータが全部消えたり、<br>個人情報がばらまかれるとかネットでは話題やで。,900480004,10,
22,上条 当麻,1000101,そんなメールを友人に転送するんじゃありません！！,900010020,11,ef_com_00100_002_001_00,
23,吹寄 制理,8000101,でも気になるわね、ウイルスでも添付されてるの？,900080003,14,ef_com_00100_002_002_00,
24,月詠 小萌,6000101,あ～、それ私の携帯にも来ましたよー。<br>先生、今日の朝は募金しちゃったのです。,900060003,15,
25,上条 当麻,1000101,え、まさか信じてるんですか？,900010030,15,ef_com_00100_002_001_00,
26,月詠 小萌,6000101,良いことをするきっかけになっただけですねー。<br>他の人にメールを転送はしてませんし。,900060007,10,
27,月詠 小萌,6000101,どちらかと言うと学校サーバーに不正アクセスがあって、<br>そこから教師グループのメーリスで送られてきたので～。,0,16,ef_com_00100_002_003_00,
28,月詠 小萌,6000101,職員室ではハッカー対策という点で問題になってます。<br>そうですか、生徒の中でも流行してるんですね……。,0,14,ef_com_00100_002_004_00,
29,青髪ピアス,48000101,あ～、ボクは登録してたクーポンサイトから来たわ。<br>結構ヤバイハッカーが送ってるメールなんやろか。,900480019,11,
30,上条 当麻,1000101,俺の携帯、データ消えないよな……？<br>そんなんなら、ちょっと不安になってきたぞ。,900010026,14,ef_com_00100_002_004_00,
31,月詠 小萌,6000101,メールを広めた手段はともかく、<br>メールデータにウイルスの形跡はなかったのです。,900060008,20,
32,月詠 小萌,6000101,携帯データが消えるというのも、<br>多分デマでしょうね～。それより――,0,10,
33,月詠 小萌,6000101,人のアンケートを勝手に見ちゃダメなのですーーっ！,900060021,13,ef_com_00100_002_005_00,
34,上条たち,,「ご、ごめんなさい……」,0,,,
35,月詠 小萌,6000101,大体、この上条ちゃん祭りはなんですか！<br>アンケート、真面目に書き直すですよー！,900060018,13,ef_com_00100_002_005_00,
36,クラス全員,,「はあ～い」,0,
37,上条 当麻,1000101,（メール内容自体は良いことだから。<br>あんまり問題視されてないみたいだな……）,0,10,
38,上条 当麻,1000101,（だけど犯人は、学校サーバーやクーポンサイトの<br>登録者をハッキングしてメールするようなやつなのか）,0,23,ef_com_00100_002_001_00,
39,上条 当麻,1000101,（そんな凄腕ハッカーが、<br>本当にただの愉快犯なのか……？）,0,10,ef_com_00100_002_002_00,
