#ID,名称,CharaID,メッセージ,ボイスID,表情差分,エモーション,
#,,,レイドイベント: 学園都市のクリスマス チャプター2,
#,,,トナカイ、空を飛ぶ,,,,
#,,,#【公園・内部A・夕】,,,,
1,上条 当麻,1000901,痛だだだ……っ！？　お前ら、子どもが見てるのに<br>全く手加減とかしてくれねーんだな！？,900010027,14,ef_com_00100_002_003_00,
2,上条 当麻,1000901,くそう、情けねぇけど……<br>ここは戦略的撤退だ！,900010025,16,
3,御坂 美琴,4000901,あっ、コラ待ちなさい！<br>どこ行くつもりよ！,900040021,13,ef_com_00100_002_005_00,
4,インデックス,2001301,舞台から降りるなんてズルいんだよ、とうまっ！,900020024,20,,
5,男の子,58000101,あー！　トナカイがにげたぞー！,900580021,13,,
6,女の子,59000101,サンタのおねえちゃん！<br>悪いトナカイさんをつかまえてー！,900590011,15,,
#,,,#【暗転】,
7,上条 当麻,1000901,……はあ、はあ……。<br>なんとか舞台からは逃げ出せたが……どうしたものか。,900010026,16,ef_com_00100_002_004_00,
8,上条 当麻,1000901,とりあえず木に登って隠れるとするか……よっと！<br>……よし、ここなら暗いし見つからないだろう。,,23,,
9,上条 当麻,1000901,ふぅ、これでひとまずは安心だな。<br>木の上で様子を窺いながら、しばらくやり過ごそう。,900010015,10,,
10,御坂 美琴,4000901,あーもうっ見失った、相変わらず逃げ足が速い……！<br>でも遠くには行かないだろうし、どこかに隠れたはずね。,900040025,16,
11,インデックス,2001301,うーん、近くに隠れてるとしても……日が暮れて<br>暗くなってきたから、とうまを見つけるのは大変かも。,900020015,14,
12,白井 黒子,5000801,ですけど、このままではケダモノが野放しですの。<br>わたくしが辺りを手当たり次第に探してきますのよ？,900050004,13,,
13,御坂 美琴,4000901,いいえ、大丈夫よ。<br>……出てこないなら、こっちにも考えがあるわ。,900040008,11,
14,御坂 美琴,4000901,聞こえてるでしょう！　アンタは忘れてるみたいだけど、<br>この公園の木には今、何が巻いてあるか分かってる？,900040022,20,
15,インデックス,2001301,？　木に巻いてあるって……あっ！<br>そっか、クリスマスイベント用の電飾の飾り付け！,900020011,15,ef_com_00100_002_001_00,
16,御坂 美琴,4000901,そう、今この公園の木には電飾が巻いてあるのよ！<br>暗くて見えないなら、明るくして見つけ出してやるわ！,900040006,20,
17,上条 当麻,1000901,な、何だ……？　よく聞こえなかったけど、<br>御坂のヤツ、電撃をバチバチさせて何してるんだ……！？,900010018,21,ef_com_00100_002_002_00,
18,御坂 美琴,4000901,クリスマスツリー、一斉点灯！！,,13,,
19,女の子,59000101,わあーっ、ツリーがぜんぶ光ってる！<br>ピカピカして、とってもキレー！,900590009,17,ef_com_00100_002_000_00,
20,男の子,58000101,おーすげーっ！　あんなことができるなんて、<br>サンタのおねえちゃん、カッケー！！,900580010,17,ef_com_00100_002_000_00,
21,上条 当麻,1000901,んなっ！？　いきなり電飾が光り出した！？<br>ま、眩しい……！　何なんだ、急に！,900010030,16,ef_com_00100_002_001_00,
22,インデックス,2001301,あっ、あの木を見て！<br>トナカイの角が木の葉の間から見えてるよ！,900020001,12,
23,御坂 美琴,4000901,あそこかっ、木に登っていたのね！<br>うまく隠れたつもりでしょうけど、見つけたわよ！,900040022,13,
24,白井 黒子,5000801,お姉様、わたくしにお任せくださいっ。<br>すぐにあの類人猿を追い詰めてやりますのよ！,900050002,12,,
25,上条 当麻,1000901,ッ！？　白井がいつの間にか背後に……！？<br><ruby>空間移動</ruby>で飛んできやがったのか！？,900010025,15,,
26,白井 黒子,5000801,んふ、うふふふふ……さぁ覚悟しなさいな。<br>お姉様への数々の無礼、たっぷり後悔させてあげますの。,900050011,21,
27,上条 当麻,1000901,ちょっ、危ないから木の上で動くなって……！<br>こ、こっち来るな！　落ちる、落ちるっ！,900010017,21,,
28,白井 黒子,5000801,そのとち狂った頭を一度くらい打った方が<br>少しはまともな人間になれるかもしれませんわ、うふふ。,900050018,21,
29,上条 当麻,1000901,ちょっと待て！？　落ち着いて話そう！<br>話せば分かる、なっ！？,900010029,21,ef_com_00100_002_003_00,
30,白井 黒子,5000801,話す事など何もありませんわ！<br>大人しく制裁を受ければ良いんですのよ！,900050025,20,
31,上条 当麻,1000901,くっ、このままだと落ちる……！<br>こうなったら、隣の木に跳び移るしかない！,900010026,13,
32,白井 黒子,5000801,あっ、また逃げるんですの！？<br>隣の木まで距離がありますのよ、諦めなさいっ。,900050027,15,
33,上条 当麻,1000901,捕まったら、何されるか分かんねーからな！<br>……よし。俺は跳べる、大丈夫……行くぞっ！　それっ！,900010027,20,,
34,女の子,59000101,す、すごい、見て見て！<br>トナカイさんが木から飛びだしてきたよ！,900590009,12,ef_com_00100_002_000_00,
35,男の子,58000101,わー、カッケー！　悪ものだけど、空飛ぶトナカイだ！<br>すっげー、もっと飛んで飛んでー！,900580010,12,ef_com_00100_002_000_00,
36,上条 当麻,1000901,おっ、とととっ。<br>よし、なんとか落ちずに跳び移れたぜ……！,900010015,16,,
37,白井 黒子,5000801,くっ、本当に跳ぶなんて……どこに行きましたの！？<br>姿を現しなさい、この類人猿がっ！,900050026,16,,
38,上条 当麻,1000901,……どうやら白井は俺を見失ってるみたいだな。<br>じゃあ今のうちに木から降りて、逃げよう。,900010002,11,
39,上条 当麻,1000901,大体、舞台での事は悪気があった訳じゃないんだが……。<br>……おっと、あと少しで地上に降りられる――。,,23,
40,インデックス,2001301,――とうま、待ってたんだよ。,900020021,20,
41,御坂 美琴,4000901,黒子が木の上にいるからね。<br>また逃げるなら木から降りると思ったのよ。,900040002,22,
42,上条 当麻,1000901,うわあぁあぁっ！？<br>イ、インデックス……それに、御坂も……！,900010016,15,
43,上条 当麻,1000901,ま、待ってくれ二人共！<br>アレは事故であって決してわざとじゃないんだ！,900010018,21,ef_com_00100_002_003_00,
44,インデックス,2001301,とうまは、いっっっつもそう言うんだよ。<br>だから、もう騙されないかも。,900020024,13,
45,上条 当麻,1000901,いやだからホントだって！　信じてくれよ！,900010007,21,
46,御坂 美琴,4000901,逃げ出したヤツの言い訳を聞くと思う？<br>子ども達も見てるんだから、潔く罪を認めなさいっ。,900040024,20,,
47,インデックス,2001301,悪いトナカイは……<br>雪の女王とサンタさんがお仕置きするんだよ！,900020021,20,
48,上条 当麻,1000901,ま、まっ、待てインデックス！？<br>頭をかじるのだけは勘弁しギャアアァァアッ！！,900010027,22,
49,上条 当麻,1000901,トナカイになってもいつも通りかよぉ……！<br>ううっ、不幸だぁあああ――っ！！,900010023,14,
#,,,#END,



























































































