#ID,名称,CharaID,メッセージ,ボイスID,表情差分,エモーション,
#,,,とある高校 Chapter1,
#,,,真理への不毛なる探求,,,,
#,,,#【上条の学校・教室・昼】,
1,姫神 秋沙,23000101,おはよう。,900230001,10,
2,青髪ピアス,48000101,なあカミやん。<br>ボクな、昨日思ったんよ……。,900480029,14,ef_com_00100_002_006_00,
3,上条 当麻,1000101,おう、悪いけどさ。<br>スーパーの特売があるから、その話はまた今度な。,900010003,11,
4,青髪ピアス,48000101,まだ始業前やん！　興味なさすぎやない！？,900480017,13,ef_com_00100_002_003_00,
5,上条 当麻,1000101,なんかくだらねぇ匂いがしたからな。,900010015,10,ef_com_00100_002_004_00,
6,土御門 元春,3000101,それは一理あるにゃー。,900030004,12,
7,青髪ピアス,48000101,酷い！　酷いわ、ふたりとも！<br>親友がこんなにも真剣に話しとるのに！,900480021,14,ef_com_00100_002_005_00,
8,姫神 秋沙,23000101,（……。みんな。朝から楽しそう）,900230015,11,
9,上条 当麻,1000101,ん？　おう、姫神来てたのか。,900010001,10,ef_com_00100_002_001_00,
10,姫神 秋沙,23000101,うん。挨拶はしたのだけれど。気づかれなかった。,900230006,14,
11,上条 当麻,1000101,そ、それは申し訳ない……。,900010013,21,ef_com_00100_002_003_00,
12,青髪ピアス,48000101,そんなことより、姫神ちゃん聞いてや～。<br>カミやんと土御門が、ボクの話を聞こうともせんのよ。,900480026,14,
13,姫神 秋沙,23000101,話って。例えば。,900230004,10,ef_com_00100_002_002_00,
14,青髪ピアス,48000101,うう……。<br>姫神ちゃんの優しさが、傷ついた心にしみるわ～。,900480014,11,ef_com_00100_002_007_00,
15,上条 当麻,1000101,姫神、無理して聞いてやらなくてもいいんだぞ？,900010018,11,
16,姫神 秋沙,23000101,別に。無理はしてない。,900230008,10,
17,青髪ピアス,48000101,それでな、ボク、思ったんやけど……ズバリ！<br>女の子の萌え要素はキャラ立てで決まるんちゃうかと！,900480004,12,ef_com_00100_002_000_00,
18,姫神 秋沙,23000101,……。無理ではなくても。無駄ではあったみたい。,900230016,14,ef_com_00100_002_004_00,
19,青髪ピアス,48000101,ちょちょちょ、ちょーっと待って！<br>まだ徐の徐の口！,900480017,15,ef_com_00100_002_003_00,
20,青髪ピアス,48000101,それに、この話は、<br>姫神ちゃんにも関係あることやで！？,900480029,13,
21,姫神 秋沙,23000101,どういうこと？,900230004,15,ef_com_00100_002_002_00,
22,青髪ピアス,48000101,萌え要素がキャラ立てで決まると認められれば、<br>キミの地味属性をもう一捻りできるかもしれん。,900480004,10,
23,青髪ピアス,48000101,そうすれば、挨拶をしても気づかれない……<br>なんてこともなくなるはずや！,,12,
24,姫神 秋沙,23000101,それは。興味深い。,900230003,10,ef_com_00100_002_001_00,
25,上条 当麻,1000101,ええっ！？　食いつくんですか、姫神さん！？,900010030,15,ef_com_00100_002_003_00,
26,土御門 元春,3000101,これはなんだか面白い話になってきたにゃ～。<br>オレも聞かせてもらうぜい。,900030004,12,ef_com_00100_002_000_00,
27,青髪ピアス,48000101,ようやくこの話の重要性に気づいてくれたか。<br>ちなみに、土御門はどう思う？,900480011,12,
28,土御門 元春,3000101,萌え要素がキャラ立てで決まるということには、<br>オレも賛成だにゃ～。,900030005,10,
29,土御門 元春,3000101,でも、キャラが立ってるって意味では、<br>姫神は割と強烈じゃないかにゃ～？　巫女だし。,900030008,11,ef_com_00100_002_002_00,
30,姫神 秋沙,23000101,私は巫女じゃなくて。魔法使い。,900230023,11,ef_com_00100_002_004_00,
31,青髪ピアス,48000101,巫女でも魔法使いでも、制服を着て登校してる時点で<br>キャラを殺しとるやろ。まさにキャラ自殺！,900480018,14,ef_com_00100_002_000_00,
32,姫神 秋沙,23000101,じゃあ。巫女服を着れば。キャラが生き返る？,900230026,10,ef_com_00100_002_002_00,
33,青髪ピアス,48000101,それは……。,900480012,14,
34,土御門 元春,3000101,すんなり頷けないのが、<br>困ったところなんだにゃ～。,900030013,14,ef_com_00100_002_004_00,
#,,,#END,
