#ID,名称,CharaID,メッセージ,ボイスID,表情差分,エモーション,
#,,,チャプター22：上条当麻の学校　月詠 小萌　黄泉川 愛穂　,,,,
#,,,大人の息抜き,
1,月詠 小萌,6000101,はー、肩が凝った。採点作業は疲れるのですー。,900060015,16,ef_com_00100_002_004_00,
2,黄泉川 愛穂,7000101,その見た目で肩が凝ったって言われても説得力が<br>皆無じゃんよ。,900070001,10,
3,月詠 小萌,6000101,見た目で人の疲れを判断しないで欲しいのですー！<br>はー、肩が重いのですー。肩甲骨がだるいー。,900060025,13,
4,黄泉川 愛穂,7000101,そんなに疲れてんなら、今度温泉でも行くじゃんよ？,900070029,12,
5,月詠 小萌,6000101,ものすごく行きたいですけど、お互いそんな暇は<br>ない気がするのです～？,900060006,16,
6,黄泉川 愛穂,7000101,旅は無理でも、深夜と言う手があるじゃんよ。<br>女性専門の深夜スパが学園都市にもできたじゃん。,900070005,10,
7,月詠 小萌,6000101,それは知らなかったのです……！<br>アルコールは置いてるのですー？,900060030,10,
8,黄泉川 愛穂,7000101,当然じゃんよ。生ビールがそこそこ安かったじゃんよ。,900070011,12,
9,月詠 小萌,6000101,今夜にでも行くのです！<br>ああ、持つべきものは生活に疲れた妙齢で独身の友！,900060011,12,ef_com_00100_002_007_00,
10,黄泉川 愛穂,7000101,その言い方はなんか引っかかるじゃんよ。<br>まー、まったく否定できないけど。,900070018,11,ef_com_00100_002_006_00,
