#ID,名称,CharaID,メッセージ（全角26文字x2行）,ボイスID,表情差分,
#,,,遊び方,
#,,,ワールドイベント（コラボ特別ミッション[前編]）,
#,,,#,,,
1,月詠 小萌,6000101,開催されているイベントの情報をお伝えするのです！,900060001,10,
2,月詠 小萌,6000101,今回のイベントは、とある邂逅の世界祝福[前編]と<br>連動した「ワールドイベント」となります！,
3,月詠 小萌,6000101,ワールドイベントとは、設定された目標の達成を、<br>全プレイヤーの皆さんで目指すイベントなのです！,900060034,20,
101,月詠 小萌,6000101,今回は、とある邂逅の世界祝福[前編]で取得できる<br>「このすばコラボポイント[前編]」を集めることで、,900060050,20,
102,月詠 小萌,6000101,ワールドイベント内で設定されたポイント目標を<br>達成し、豪華報酬をゲットできる仕組みです！,
201,月詠 小萌,6000101,集めるポイントは、該当イベントのミッションや<br>該当イベントのボスを撃破することで取得できます！,900060049,13,
202,月詠 小萌,6000101,皆さんが集めたポイント数の合計が集計されて、<br>その結果で達成した報酬が、皆さんに配られます。,
203,月詠 小萌,6000101,皆さんが一丸となって協力すれば<br>必ず目標を達成できると、先生は信じてますよー！,900060052,12,
