#ID,名称,CharaID,メッセージ,ボイスID,表情差分,エモーション,
#,スポット会話,,チャプター14：学生寮前　インデックス　御坂妹　,
#,,,迷子のスフィンクス,
1,インデックス,2000101,スフィンクス－！　どこ行っちゃったんだよー？,900020023,14,ef_com_00100_002_003_00,
2,御坂妹,21000101,あの猫がどうかしたのですか。と、ミサカは切迫した<br>雰囲気を感じ取り、どういう状況なのか説明を求めます。,900210003,10,ef_com_00100_002_002_00,
3,インデックス,2000101,さっきから探してるんだけど、どこにもいないんだよ。<br>このままじゃ夜になっちゃう……。,900020012,16,ef_com_00100_002_004_00,
4,御坂妹,21000101,それはまずいですね。と、ミサカは即座に状況を把握し、<br>猫の安否について危惧します。,900210004,14,
5,インデックス,2000101,暗い中一人っきりだなんて……<br>スフィンクスが可哀想なんだよ。,900020015,14,
6,御坂妹,21000101,探しましょう、私も手伝いますので。<br>と、ミサカは捜索のアシストを申し出ます。,900210005,10,
7,インデックス,2000101,え、いいの？,900020030,15,ef_com_00100_002_001_00,
8,御坂妹,21000101,もちろんです。早く探してあげましょう。と、<br>ミサカは全ネットワークを駆使し、捜索を開始します。,900210005,12,
















































