#ID,名称,CharaID,メッセージ,ボイスID,表情差分,エモーション,
#,,,チャプター17：病院　神裂 火織　ステイル＝マグヌス　,,,,
#,,,ニコチン中毒,
1,神裂 火織,25000101,ステイル……ここは禁煙だそうですよ。,900250029,10,
2,ステイル,24000101,これくらい見逃してくれないか。<br>ニコチンとタールがない世界で僕は生きていけないんだ。,900240015,10,
3,神裂 火織,25000101,最近少し本数が増えていませんか？<br>その量を吸い続けるのは体に影響が……。,900250015,11,
4,ステイル,24000101,困ったな。君まで僕を責めはじめるのかい？,900240023,11,ef_com_00100_002_004_00,
5,ステイル,24000101,最近じゃ禁煙しろしろってうるさいのがいてね。<br>顔をあわせる度に禁煙を促されるからとてもやり辛いよ。,0,10,
6,ステイル,24000101,所詮は他人事なんだから、<br>放っておいてくれればいいのにね。,900240023,11,
7,神裂 火織,25000101,それは……あなたの体を案じているからでは。,900250008,10,
8,ステイル,24000101,だとしてもだ。自分のことくらい自分で決めるよ。,900240007,11,

