#ID,名称,CharaID,メッセージ,ボイスID,表情差分,エモーション,
#,
#,,,夢と皆との別れ,,,,
#,,,#【汎用・白背景】,
1,司波 達也,211000101,当麻……やったみたいだな。,1,10,ef_com_00100_002_001_00,
2,司波 深雪,212000101,ええ……。,1,10,,
3,司波 達也,211000101,最後の挨拶くらいはしたかったが――。,1,11,
4,上条 当麻,1002101,――おーい！！,1,15,ef_com_00100_002_003_00,
5,司波 達也,211000101,当麻……！,1,15,ef_com_00100_002_001_00,
6,上条 当麻,1002101,別れの機会を作ってくれるとはな。<br>この夢も気が利くところがあるもんだな。,1,11,,
7,御坂 美琴,4002801,ホント、大変だったわね。お互い。,1,10,,
8,インデックス,2002501,楽しい夢のはずが、<br>とんでもない大冒険になっちゃったんだよ！,1,15,ef_com_00100_002_003_00,
9,上条 当麻,1002101,とにかく、最後に挨拶できて嬉しいぜ。,1,12,
10,司波 達也,211000101,……俺も、同じ事を考えていた。案外、<br>俺とお前は似ているところがあるのかもしれないな。,1,12,
11,司波 深雪,212000101,上条さんとお兄様が、ですか？,1,15,ef_com_00100_002_002_00,
12,御坂 美琴,4002801,いやいやいや。それはないって、達也さん。<br>だってコイツ、達也さんみたいに紳士的じゃないし。,1,15,ef_com_00100_002_003_00,
13,上条 当麻,1002101,余計なお世話だ！　ったく……。,1,11,ef_com_00100_002_006_00,
#,,,#【場面転換】,
14,アンジェリーナ,216000101,あ、いたいた！　おーい、皆！,1,12,ef_com_00100_002_000_00,
15,光井 ほのか,214000101,リーナ！　達也さん達、うまくいったんですね！,1,12,ef_com_00100_002_001_00,
16,北山 雫,213000101,ということは、この夢の世界ももうすぐで終わり。,1,11,,
17,光井 ほのか,214000101,仲良くなれたと思ったのに、もう皆とお別れに<br>なっちゃうなんて寂しいね……。,1,14,ef_com_00100_002_004_00,
18,北山 雫,213000101,学園都市の話、もっと聞いてみたかったし、<br>あちこち見て回りたかったな……。,1,10,
19,柴田 美月,218000101,私ももっと皆さんとご一緒したかったのですが……。<br>とても残念で仕方ありません……。,1,14,
20,初春 飾利,36002801,私達もとても残念です。事件が無ければ、この世界で<br>一緒に遊ぶ事もできたと思うんですけどね……。,1,14,ef_com_00100_002_004_00,
21,佐天 涙子,37002801,怖い事もあったけど、あたしは楽しかったな。<br>こんな夢ならまた見ても良いかなーってね？,1,10,
22,アンジェリーナ,216000101,ワタシは勘弁して欲しいわ。<br>こんなドタバタな夢なんて心臓に悪すぎるわよ。,1,15,ef_com_00100_002_003_00,
23,白井 黒子,5001401,同感ですの。次に皆さんと出会えるなら<br>もっと落ち着いて見られる夢が良いですわね。,1,13,ef_com_00100_002_004_00,
#,,,#【場面転換】,
24,打ち止め,22000101,七草のお姉ちゃんとお別れするなんてやだー！,1,14,ef_com_00100_002_003_00,
25,打ち止め,22000101,ってどうしようも無いと分かってはいながら<br>ミサカはミサカは抱き着いてワガママを言ってみたり！,1,14,
26,七草 真由美,215000101,……私も<ruby>打ち止め</ruby>ちゃんと別れる事になるなんて<br>とても寂しいわ。もっとお喋りしたかったんだけどね。,1,14,ef_com_00100_002_004_00,
27,打ち止め,22000101,この人を一緒に捜してくれてありがとう。七草の<br>お姉ちゃんの事忘れないよってミサカはミサカは……！,1,14,
28,七草 真由美,215000101,……っ、私もあなたに会えてとても楽しかったわ。<br>夢で出会ったあなたの事を忘れない。,1,14,
29,七草 真由美,215000101,それと……<ruby>一方通行</ruby>。,1,10,,
30,一方通行,13001901,……ンだよ。俺に言う事なンて何も無ェはずだろ。,1,23,ef_com_00100_002_001_00,
31,七草 真由美,215000101,これからはもっと、女の子には優しくしなきゃダメよ。,1,12,
32,一方通行,13001901,……ハァ、何言い出すかと思ったら<br>やっぱり余計な世話じゃねェか……。,1,22,ef_com_00100_002_006_00,
33,一方通行,13001901,どうせ今回の事は夢だ、適当に覚えておいてやるよ……。,1,11,
#,,,#【場面転換】,
34,司波 深雪,212000101,美琴さん、インデックスさん。今回の一件、お兄様に<br>協力してくれてありがとう。本当に助かったわ。,1,10,,
35,インデックス,2002501,こちらこそなんだよ。たつやがいなかったら<br>とうまもどうしたら良いか分からなかったかも。,1,10,,
36,御坂 美琴,4002801,今回はほんと達也さんにはお世話になったわ。<br>学園都市でもあんな実力を持つ人、なかなかいないわよ。,1,10,,
37,御坂 美琴,4002801,深雪さんが心から信頼してるのもよーく分かるわね。,1,12,
38,インデックス,2002501,さすが兄妹ってことなのかな？<br>二人はすごく通じ合っていた感じがしたかも！,1,12,
39,司波 深雪,212000101,も、もうインデックスさんってば、わたしとお兄様の<br>想いが通じ合っている、だなんて……！,1,17,ef_com_00100_002_003_00,
40,インデックス,2002501,えっ？　言ったこととちょっと違う気がするんだよ……。,1,15,ef_com_00100_002_002_00,
41,司波 深雪,212000101,……でも、事故ではあったけど、わたしもお兄様も<br>あなた達に出会えて、本当によかったと思う。,1,10,
42,司波 深雪,212000101,ありがとう。この出会いは忘れないわ。,1,12,
43,御坂 美琴,4002801,私も忘れないわ。あなた達、兄妹の事を。,1,12,
#,,,#【場面転換】,
44,上条 当麻,1002101,なぁ達也。俺達が探索してた研究所にあった物。<br>あれって一体何なのか知ってるのか？,1,10,
45,司波 達也,211000101,俺は直接見ていないから詳しくは知らないが……。<br>恐らくは『<ruby=レリック>聖遺物</ruby>』の一種だと思われる。,1,11,,
46,司波 達也,211000101,大型<ruby=シーエーディー>ＣＡＤ</ruby>による子供達の魔法に『<ruby=レリック>聖遺物</ruby>』が呼応し、<br>この混在した世界を実現したのかもしれんな。,1,10,,
47,御坂 美琴,4002801,達也さん、ごめん。一つお願いがあるんだけど……。,1,14,ef_com_00100_002_004_00,
48,司波 達也,211000101,……？,1,10,
49,御坂 美琴,4002801,子供達から聞いたの。,1,11,
50,御坂 美琴,4002801,あの子達、現実の達也さん達の世界でも<br>人体実験のモルモットにされているらしくて……。,1,14,
51,御坂 美琴,4002801,ずっと助けを待ってたみたいで、<br>今も達也さん達の世界で助けを待ち続けてるの。,1,14,
52,御坂 美琴,4002801,あの子達を助けてあげて、達也さん！,1,14,ef_com_00100_002_003_00,
53,御坂 美琴,4002801,あの子達、お姉ちゃん達の助けを待ってるね<br>って言ってたから！,1,14,
54,御坂 美琴,4002801,私達の世界からじゃ、悔しいけど何もできないから……。<br>――だから、お願いします。,1,14,
55,上条 当麻,1002101,俺からもよろしく頼む！,1,11,
56,司波 達也,211000101,分かった、必ず助けてみせる。,1,10,
57,司波 深雪,212000101,お兄様、わたし達、<br>足先から消え始めています――……！,1,15,ef_com_00100_002_003_00,
58,司波 達也,211000101,……別れの時間ももう終わり、か。,1,11,
60,上条 当麻,1002101,じゃあな、達也。,1,12,
61,司波 達也,211000101,達者でな、当麻。,1,12,
#,,,#【ホワイトアウト】,,,,
#,,,#END,
